type,start,end,strand,attributes,locus_name,Rv_name,product_name,function_group,prev_start,prev_end,next_start,next_end,overlap_prev,overlap_next,seq_upstream,seq_next_upstream,start_codon,deltaG,RBS_dist,has_RBS,next_has_RBS,next_deltaG,next_RBS_dist,n_overlap_prev,n_overlap_next,seq_overlap_prev,seq_overlap_next,group,frame
CDS,497314,498300,-,"Locus=Rv0411c;Name=glnH;Function=Involved in active transport of glutamine across the membrane (import). Interacts with the glutamine-transport system.;Product=Probable glutamine-binding lipoprotein GlnH (GLNBP);Comments=Rv0411c, (MTCY22G10.07c), len: 328 aa. Probable glnH, glutamine-binding protein, membrane-bound lipoprotein (see citation below), equivalent to AL035159|MLCB1450_15|T44736|4154051|CAA22704.1 glutamine-binding protein homolog from Mycobacterium leprae (325 aa), FASTA scores: opt: 1747, E(): 0, (79.3% identity in 328 aa overlap). Also similar to others e.g. GLNH_BACST|P27676 glutamine-binding protein precursor from Bacillus stearothermophilus (262 aa), FASTA scores: opt: 493, E(): 7.5e-22, (37.8% identity in 193 aa overlap); etc. Contains PS00013 Prokaryotic membrane lipoprotein lipid attachment site, PS01039 Bacterial extracellular solute-binding proteins, family 3 signature. Belongs to the bacterial extracellular solute-binding protein family 3. Presumed attached to the membrane by a lipid anchor.;UniProt_AC=P96257;Is_Pseudogene=No;Functional_Category=cell wall and cell processes;Protein Data Bank=;PFAM=P96257;UniProt=P96257;Gene Ontology=GO:0006810,GO:0005215,GO:0030288;Enzyme Classification=;Drug Resistance Mutations=;InterPro=;UniProtKB/TrEMBL=;SWISS-MODEL=P96257",glnH,Rv0411c,Probable glutamine-binding lipoprotein GlnH (GLNBP),cell wall and cell processes,498300,499619,495062,497314,TRUE,TRUE,GGCTGAAAGAGTATC,CGCCGAGGTATGTGG,ATG,-0.359835,9,FALSE,TRUE,-6.004895,11,1,1,A,A,325,1
CDS,498300,499619,-,"Locus=Rv0412c;Name=Rv0412c;Function=Unknown;Product=Possible conserved membrane protein;Comments=Rv0412c, (MTCY22G10.08c), len: 439 aa. Possible conserved membrane protein, equivalent to AL035159|MLCB1450_16|T44737 probable membrane protein from Mycobacterium leprae (403 aa), FASTA scores: opt: 2027, E(): 0, (80.4% identity in 403 aa overlap). Also some similarity with CAB71201.1|AL138538 putative secreted protein from Streptomyces coelicolor (429 aa).;UniProt_AC=P96258;Is_Pseudogene=No;Functional_Category=cell wall and cell processes;Protein Data Bank=;PFAM=;UniProt=P96258;Gene Ontology=;Enzyme Classification=;Drug Resistance Mutations=;InterPro=;UniProtKB/TrEMBL=;SWISS-MODEL=P96258",Rv0412c,Rv0412c,Possible conserved membrane protein,cell wall and cell processes,500350,501018,497314,498300,FALSE,TRUE,AGATGAGGTCCTAAC,GGCTGAAAGAGTATC,GTG,-5.904895,11,TRUE,FALSE,-0.359835,9,,1,,A,326,1
CDS,517803,518396,-,"Locus=Rv0429c;Name=def;Function=Removes the formyl group from the N-terminal met of newly synthesized proteins [catalytic activity: N-formyl-L-methionine + H2O = formate + L-methionine].;Product=Probable polypeptide deformylase Def (PDF) (formylmethionine deformylase);Comments=Rv0429c, (MTCY22G10.26c), len: 197 aa. Probable def, polypeptide deformylase, equivalent to CAC30884.1|AL583923 polypeptide deformylase from Mycobacterium leprae (197 aa). Also similar to others e.g. DEF_ECOLI|P27251|95874|S23107 polypeptide deformylase from Escherichia coli (169 aa), FASTA scores: opt: 179, E(): 1.8e-05, (34.6% identity in 162 aa overlap); etc. Belongs to the polypeptide deformylase family. Cofactor: binds 1 zinc ion.;UniProt_AC=P9WIJ3;Is_Pseudogene=No;Functional_Category=information pathways;Protein Data Bank=3E3U;PFAM=P96275;UniProt=P9WIJ3;Gene Ontology=GO:0042586,GO:0006412,GO:0005506;Enzyme Classification=3.5.1.88;Drug Resistance Mutations=;InterPro=;UniProtKB/TrEMBL=;SWISS-MODEL=P9WIJ3",def,Rv0429c,Probable polypeptide deformylase Def (PDF) (formylmethionine deformylase),information pathways,522347,524533,516895,517803,FALSE,TRUE,GCGCTTAAGCTAGCC,CCGACCCGTTCGGTC,ATG,0.9151,12,FALSE,FALSE,-1.469835,6,,1,,A,328,1
CDS,725013,728306,-,"Locus=Rv0631c;Name=recC;Function=Involved in homologous recombination.;Product=Probable exonuclease V (gamma chain) RecC (exodeoxyribonuclease V gamma chain)(exodeoxyribonuclease V polypeptide);Comments=Rv0631c, (MTCY20H10.12c), len: 1097 aa. Probable recC, exonuclease V, gamma chain (exodeoxyribonuclease V, gamma chain) (see Mizrahi & Andersen 1998), highly similar to other exonucleases e.g. AF157643_1|RecC|AAD46807.1 Escherichia coli RecC protein homolog from Mycobacterium smegmatis (1085 aa); P07648|EX5C_ECOLI|B2822 exodeoxyribonuclease V 125 kDa polypeptide (exonuclease V gamma chain) from Escherichia coli strain K12 (1122 aa), FASTA scores: opt: 954, E(): 0, (29.2% identity in 1109 aa overlap); etc. Consists of three subunits; RECB|Rv0630c, RECC and recd|Rv0629c. The transcription of this CDS seems to be activated specifically in host granulomas (see Ramakrishnan et al., 2000).;UniProt_AC=P9WIQ5;Is_Pseudogene=No;Functional_Category=information pathways;Protein Data Bank=;PFAM=;UniProt=P9WIQ5;Gene Ontology=GO:0006281,GO:0004519,GO:0008854,GO:0009338,GO:0004386,GO:0005524;Enzyme Classification=3.1.11.5;Drug Resistance Mutations=;InterPro=;UniProtKB/TrEMBL=;SWISS-MODEL=P9WIQ5",recC,Rv0631c,Probable exonuclease V (gamma chain) RecC (exodeoxyribonuclease V gamma chain)(exodeoxyribonuclease V polypeptide),information pathways,728583,729278,721729,725013,FALSE,TRUE,TCGACTAGGGTGACG,CCGCCGAAGGGTCGG,ATG,-4.578055,8,TRUE,TRUE,-7.841975,6,,1,,A,342,1
CDS,858037,858864,-,"Locus=Rv0765c;Name=Rv0765c;Function=Function unknown; probably involved in cellular metabolism, possibly electron transfer.;Product=Probable oxidoreductase;Comments=Rv0765c, (MTCY369.10c), len: 275 aa. Probable oxidoreductase, similar others e.g. P39071|DHBA_BACSU 2,3-dihydro-2,3-dihydroxybenzoate dehydrogenase from Bacillus subtilis (261 aa), FASTA scores: opt: 385, E(): 1.8e-17, (30.6% identity in 252 aa overlap); AAF81239.1|AF263012 putative beta-ketoacyl reductase from Streptomyces griseus (274 aa); NP_436514.1|NC_003037 putative oxidoreductase from Sinorhizobium meliloti (240 aa); etc. Also similar to several other oxidoreductases from Mycobacterium tuberculosis e.g. Rv1544|MTCY48.21, FASTA score: (32.6% identity in 267 aa overlap); etc. Contains PS00061 Short-chain alcohol dehydrogenase family signature.;UniProt_AC=I6WZD9;Is_Pseudogene=No;Functional_Category=intermediary metabolism and respiration;Protein Data Bank=;PFAM=P71821;UniProt=I6WZD9;Gene Ontology=GO:0055114,GO:0016491;Enzyme Classification=1.-.-.-;Drug Resistance Mutations=;InterPro=;UniProtKB/TrEMBL=;SWISS-MODEL=I6WZD9",Rv0765c,Rv0765c,Probable oxidoreductase,intermediary metabolism and respiration,858864,860072,856682,858037,TRUE,TRUE,TCAGCGTGCAGGCCA,AAGAGGGGATGCCGG,ATG,-2.032995,9,FALSE,TRUE,-6.141975,10,1,1,A,A,349,1
CDS,858864,860072,-,"Locus=Rv0766c;Name=cyp123;Function=Cytochromes P450 are a group of heme-thiolate monooxygenases. They oxidize a variety of structurally unrelated compounds, including steroids, fatty acids, and xenobiotics.;Product=Probable cytochrome P450 123 Cyp123;Comments=Rv0766c, (MT0790, MTCY369.11c), len: 402 aa. Probable cyp123, cytochrome P-450, similar to others e.g. P33271|CPXK_SACER cytochrome P-450 107B1 from Saccharopolyspora erythraea (405 aa), FASTA scores: opt: 770, E(): 0, (36.9% identity in 406 aa overlap); T36526 probable cytochrome P450 hydroxylase from Streptomyces coelicolor (411 aa); P27632|CPXM_BACSU cytochrome P450 109 from Bacillus subtilis (405 aa); etc. Also similar to several other cytochromes P-450 from Mycobacterium tuberculosis e.g. Rv1256c|MTCY50.26 (405 aa), FASTA score: (35.2% identity in 389 aa overlap); etc. Contains PS00086 Cytochrome P450 cysteine heme-iron ligand signature. Belongs to the cytochrome P450 family.;UniProt_AC=P9WPP5;Is_Pseudogene=No;Functional_Category=intermediary metabolism and respiration;Protein Data Bank=;PFAM=P63707;UniProt=P9WPP5;Gene Ontology=GO:0020037,GO:0004497,GO:0055114,GO:0009055;Enzyme Classification=1.14.-.-;Drug Resistance Mutations=;InterPro=;UniProtKB/TrEMBL=;SWISS-MODEL=P9WPP5",cyp123,Rv0766c,Probable cytochrome P450 123 Cyp123,intermediary metabolism and respiration,860069,860710,858037,858864,TRUE,TRUE,CGAGCACTGGTGGCA,TCAGCGTGCAGGCCA,ATG,-1.469835,9,FALSE,FALSE,-2.032995,9,4,1,ATGA,A,349,1
CDS,1082584,1083750,-,"Locus=Rv0972c;Name=fadE12;Function=Function unknown, but involved in lipid degradation.;Product=Acyl-CoA dehydrogenase FadE12;Comments=Rv0972c, (MTCY10D7.02), len: 388 aa. fadE12, acyl-CoA dehydrogenase, highly similar to many e.g. CAB95893.1|AL359988 putative acyl CoA dehydrogenase from Streptomyces coelicolor (382 aa); P45857|ACDB_BACSU from Bacillus subtilis (379 aa), FASTA scores: opt: 576, E(): 2.3e-26, (29.7% identity in 381 aa overlap); etc.;UniProt_AC=P9WQG3;Is_Pseudogene=No;Functional_Category=lipid metabolism;Protein Data Bank=;PFAM=P71539;UniProt=P9WQG3;Gene Ontology=GO:0003995,GO:0055114,GO:0050660;Enzyme Classification=1.3.99.-;Drug Resistance Mutations=;InterPro=;UniProtKB/TrEMBL=;SWISS-MODEL=P9WQG3",fadE12,Rv0972c,Acyl-CoA dehydrogenase FadE12,lipid metabolism,1083747,1085750,1081775,1082584,TRUE,TRUE,CAGCAGAAGGAGATT,GTCTGCCCCGGTCCT,GTG,-6.768055,9,TRUE,FALSE,-1.469835,8,4,1,GTGA,A,356,1
CDS,1230971,1231291,-,"Locus=Rv1103c;Name=mazE3;Function=Function unknown;Product=Possible antitoxin MazE3;Comments=Rv1103c, (MTV017.56c), len: 106 aa. Possible mazE3, antitoxin, part of toxin-antitoxin (TA) operon with Rv1102c (See Pandey and Gerdes, 2005; Zhu et al., 2006). Note that Zhu et al., 2006 identifies a different amino acid sequence as the possible antitoxin to Rv1102c. Similar to part of Mycobacterium tuberculosis hypothetical protein Rv2472|AL021246|MTV008_27 Mycobacterium tuberculosis (97 aa), FASTA score: opt: 135, E(): 0.0091, (45.8% identity in 72 aa overlap).;UniProt_AC=O53451;Is_Pseudogene=No;Functional_Category=virulence, detoxification, adaptation;Protein Data Bank=;PFAM=;UniProt=O53451;Gene Ontology=;Enzyme Classification=;Drug Resistance Mutations=;InterPro=;UniProtKB/TrEMBL=;SWISS-MODEL=",mazE3,Rv1103c,Possible antitoxin MazE3,"virulence, detoxification, adaptation",1232844,1233956,1230660,1230971,FALSE,TRUE,CGACGACCATACTTC,CCGCCCTCGACATCG,ATG,2.00029,17,FALSE,FALSE,2.00029,10,,1,,A,363,1
CDS,1403386,1404603,-,"Locus=Rv1256c;Name=cyp130;Function=Cytochromes P450 are a group of heme-thiolate monooxygenases. They oxidize a variety of structurally unrelated compounds, including steroids, fatty acids, and xenobiotics.;Product=Probable cytochrome P450 130 Cyp130;Comments=Rv1256c, (MT1295, MTCY50.26), len: 405 aa. Probable cyp130, cytochrome P450, similar to other cytochromes P-450 e.g. S51594 cytochrome P450 mycG from Micromonospora griseorubida (397 aa); T36526 probable cytochrome P450 hydroxylase from Streptomyces coelicolor (411 aa); CPXK_SACER|P33271|107B1 cytochrome P450 from Saccharopolyspora erythraea (405 aa), FASTA scores: opt: 639, E(): 2.7e-33, (33.2% identity in 391 aa overlap); etc. Also similar to others from Mycobacterium tuberculosis e.g. Rv0766c|MTCY369.11c cytochrome P450 (402 aa); etc. Contains PS00086 Cytochrome P450 cysteine heme-iron ligand signature. Belongs to the cytochrome P450 family.;UniProt_AC=P9WPN5;Is_Pseudogene=No;Functional_Category=intermediary metabolism and respiration;Protein Data Bank=2UUQ,2UVN,2WGY,2WH8,2WHF;PFAM=Q11062;UniProt=P9WPN5;Gene Ontology=GO:0020037,GO:0004497,GO:0055114,GO:0009055;Enzyme Classification=1.14.-.-;Drug Resistance Mutations=;InterPro=;UniProtKB/TrEMBL=;SWISS-MODEL=P9WPN5",cyp130,Rv1256c,Probable cytochrome P450 130 Cyp130,intermediary metabolism and respiration,1404717,1406084,1402778,1403386,FALSE,TRUE,AATGTCTTAGACATA,CGTTCCGAGTGACAT,ATG,1.1151,11,FALSE,FALSE,-0.359835,11,,1,,A,374,1
CDS,1602321,1603928,-,"Locus=Rv1427c;Name=fadD12;Function=Function unknown, but supposed involvement in lipid degradation.;Product=Possible long-chain-fatty-acid--CoA ligase FadD12 (fatty-acid-CoA synthetase) (fatty-acid-CoA synthase);Comments=Rv1427c, (MTCY493.27), len: 535 aa. Possible fadD12, long-chain-fatty-acid-CoA synthetase, similar to many e.g. NP_302632.1|NC_002677 acyl-CoA synthase from Mycobacterium leprae (548 aa); AAD01929.2|AF031419 putative long-chain-fatty-acid--CoA ligase from Pseudomonas putida (565 aa); NP_419782.1|NC_002696 putative long-chain-fatty-acid--CoA ligase from Caulobacter crescentus (530 aa); PC60_YEAST|P38137 yeast peroxisomal-coenzyme A synthetase (543 aa), FASTA scores: opt: 507, E(): 2.9e-25, (30.4% identity in 365 aa overlap). Also similar to many M. tuberculosis proteins e.g. MTCY06A4.14 (44.8% identity in 525 aa overlap). Contains PS00455 Putative AMP-binding domain signature. Belongs to the ATP-dependent AMP-binding enzyme family.;UniProt_AC=O06831;Is_Pseudogene=No;Functional_Category=lipid metabolism;Protein Data Bank=;PFAM=O06831;UniProt=O06831;Gene Ontology=GO:0008152,GO:0016874;Enzyme Classification=6.2.1.-;Drug Resistance Mutations=;InterPro=;UniProtKB/TrEMBL=;SWISS-MODEL=O06831",fadD12,Rv1427c,Possible long-chain-fatty-acid--CoA ligase FadD12 (fatty-acid-CoA synthetase) (fatty-acid-CoA synthase),lipid metabolism,1603932,1604759,1601059,1602321,FALSE,TRUE,CCCGATTCTGGGCTA,AATCACGGGTCGGCA,ATG,-1.29604,8,FALSE,FALSE,-3.00755,10,,1,,A,387,1
CDS,1785912,1786310,-,"Locus=Rv1583c;Name=Rv1583c;Function=Unknown;Product=Probable PhiRv1 phage protein;Comments=Rv1583c, (MTCY336.21), len: 132 aa. Probable phiRv1 phage protein (see citation below), highly similar to Rv2656c|MTCY441.25c phiRV2 phage protein (130 aa), FASTA score: E(): 1.3e-33, (81.7% identity in 131 aa overlap). This region is a possible MT-complex-specific genomic island (See Becq et al., 2007).;UniProt_AC=P9WLU1;Is_Pseudogene=No;Functional_Category=insertion seqs and phages;Protein Data Bank=;PFAM=;UniProt=P9WLU1;Gene Ontology=;Enzyme Classification=;Drug Resistance Mutations=;InterPro=;UniProtKB/TrEMBL=;SWISS-MODEL=",Rv1583c,Rv1583c,Probable PhiRv1 phage protein,insertion seqs and phages,1786307,1786528,1784497,1785912,TRUE,TRUE,GGCGGTCAGGCGGTG,CGCGGGCGGGGGTGG,ATG,-3.478055,7,FALSE,TRUE,-8.378815,7,4,1,ATGA,A,393,1
CDS,1995054,1995842,-,"Locus=Rv1762c;Name=Rv1762c;Function=Unknown;Product=Unknown protein;Comments=Rv1762c, (MTCY28.28c), len: 262 aa. Unknown protein.;UniProt_AC=O06797;Is_Pseudogene=No;Functional_Category=conserved hypotheticals;Protein Data Bank=;PFAM=O06797;UniProt=O06797;Gene Ontology=;Enzyme Classification=;Drug Resistance Mutations=;InterPro=;UniProtKB/TrEMBL=;SWISS-MODEL=",Rv1762c,Rv1762c,Unknown protein,conserved hypotheticals,1997418,1998515,1994671,1995054,FALSE,TRUE,ACAGGAAGGACGCAC,TCCTGCCGATGGACA,ATG,-5.81615,12,TRUE,FALSE,-1.247805,7,,1,,A,405,1
CDS,2090718,2092085,-,"Locus=Rv1842c;Name=Rv1842c;Function=Unknown;Product=Conserved hypothetical membrane protein;Comments=Rv1842c, (MTCY359.31), len: 455 aa. Conserved hypothetical membrane protein. Similar to Z99109|0O7589 Potential integral membrane protein from Bacillus subtilis (461 aa), FASTA scores: opt: 723, E(): 0, (31.2% identity in 449 aa overlap). Similar to other Mycobacterium tuberculosis putative integral membrane proteins e.g. Rv2366c, Rv1841c.;UniProt_AC=P9WFP3;Is_Pseudogene=No;Functional_Category=cell wall and cell processes;Protein Data Bank=;PFAM=Q50592;UniProt=P9WFP3;Gene Ontology=GO:0005886,GO:0016021;Enzyme Classification=;Drug Resistance Mutations=;InterPro=;UniProtKB/TrEMBL=;SWISS-MODEL=P9WFP3",Rv1842c,Rv1842c,Conserved hypothetical membrane protein,cell wall and cell processes,2092259,2093698,2089681,2090718,FALSE,TRUE,CGCGACGACCGAGCC,GGTCGGGGCGGGGCC,GTG,-0.359835,7,FALSE,TRUE,-4.519565,8,,1,,A,407,1
CDS,2146245,2147633,-,"Locus=Rv1900c;Name=lipJ;Function=Function unknown; probably involved in cellular metabolism;Product=Probable lignin peroxidase LipJ;Comments=Rv1900c, (MTCY180.18), len: 462 aa. Probable lipJ, lignin peroxidase, with some similarity to esterases, hydrolases and hypothetical Mycobacterium tuberculosis proteins e.g. Q43936 beta-ketoadipate enol-lactone hydrolase from Acinetobacter calcoaceticus (267 aa), FASTA results: opt: 217, E(): 1.7e-07, (29.2% identity in 260 aa overlap). Also similar to other Mycobacterium tuberculosis hypothetical proteins e.g. Rv2212|Q10400|YM12_MYCTU (378 aa), FASTA results: opt: 216, E(): 6.7e-07, (27.7% identity in 285 aa overlap).;UniProt_AC=O07732;Is_Pseudogene=No;Functional_Category=intermediary metabolism and respiration;Protein Data Bank=1YBT,1YBU;PFAM=O07732;UniProt=O07732;Gene Ontology=GO:0004601,GO:0016849,GO:0009190;Enzyme Classification=;Drug Resistance Mutations=;InterPro=;UniProtKB/TrEMBL=;SWISS-MODEL=O07732",lipJ,Rv1900c,Probable lignin peroxidase LipJ,intermediary metabolism and respiration,2149006,2150274,2145214,2146245,FALSE,TRUE,CATGAACTAACGTAG,ACGCCACCCGCACGC,GTG,0.315099999999999,6,FALSE,FALSE,4.075225,20,,1,,A,409,1
CDS,2288681,2289241,-,"Locus=Rv2043c;Name=pncA;Function=Converts amides such as nicotinamide to corresponding acid.;Product=Pyrazinamidase/nicotinamidase PncA (PZase);Comments=Rv2043c, (MTV018.30c), len: 186 aa. PncA, pyrazinamidase/nicotinamidase (see citations below), involved in susceptibility or resistance to antituberculous drug pyrazinamide.;UniProt_AC=I6XD65;Is_Pseudogene=No;Functional_Category=intermediary metabolism and respiration;Protein Data Bank=3GBC,3PL1;PFAM=Q50575;UniProt=I6XD65;Gene Ontology=GO:0008152,GO:0016787;Enzyme Classification=3.5.1.-;Drug Resistance Mutations=PZA;InterPro=;UniProtKB/TrEMBL=;SWISS-MODEL=I6XD65",pncA,Rv2043c,Pyrazinamidase/nicotinamidase PncA (PZase),intermediary metabolism and respiration,2289282,2289599,2287884,2288681,FALSE,TRUE,CCGAACGTATGGTGG,AGTTGGTTTGCAGCT,ATG,-1.469835,7,FALSE,FALSE,-1.469835,13,,1,,A,419,1
CDS,2314825,2315061,-,"Locus=Rv2058c;Name=rpmB2;Function=Involved in ribosome activity;Product=50S ribosomal protein L28 RpmB2;Comments=Rv2058c, (MTCY63A.02), len: 78 aa. rpmB2, 50S ribosomal protein L28, very similar to rL28 of M. tuberculosis. Also similar to rpmB (Rv0105c) of Mycobacterium tuberculosis.;UniProt_AC=P9WHA9;Is_Pseudogene=No;Functional_Category=information pathways;Protein Data Bank=;PFAM=P66148;UniProt=P9WHA9;Gene Ontology=GO:0003735,GO:0006412,GO:0005840;Enzyme Classification=;Drug Resistance Mutations=;InterPro=;UniProtKB/TrEMBL=;SWISS-MODEL=P9WHA9",rpmB2,Rv2058c,50S ribosomal protein L28 RpmB2,information pathways,2316681,2317085,2314661,2314825,FALSE,TRUE,TTCGAAGGAAGGGTG,GCCAGGGGCAGCGGA,TTG,-9.213115,7,TRUE,TRUE,-5.841975,10,,1,,A,420,1
CDS,2358033,2358206,-,"Locus=Rv2099c;Name=PE21;Function=Function unknown;Product=PE family protein PE21;Comments=Rv2099c, (MTCY49.39c), len: 58 aa. PE21, Member of the Mycobacterium tuberculosis PE family (see Brennan and Delogu, 2002); 5'-end of Rv2098c|PE_PGRS36|MTCY49.38c, then frameshifts. Sequence has been checked, no errors found.;UniProt_AC=Q79FH7;Is_Pseudogene=Yes;Functional_Category=PE/PPE;Protein Data Bank=;PFAM=Q79FH7;UniProt=Q79FH7;Gene Ontology=;Enzyme Classification=;Drug Resistance Mutations=;InterPro=;UniProtKB/TrEMBL=;SWISS-MODEL=",PE21,Rv2099c,PE family protein PE21,PE/PPE,2364086,2364520,2356729,2358033,FALSE,TRUE,GGTTGGTGGGAGGTG,CGGCGCTATTTGGCG,ATG,-10.690705,6,TRUE,FALSE,0.827129999999999,17,,1,,G,423,1
CDS,2462148,2463047,-,"Locus=Rv2198c;Name=mmpS3;Function=Unknown;Product=Probable conserved membrane protein MmpS3;Comments=Rv2198c, (MTCY190.09c), len: 299 aa. Probable mmpS3, conserved membrane protein (see citation below), equivalent to ML0877|mmpS3 putative membrane protein from Mycobacterium leprae (293 aa), FASTA scores: opt: 1089, E(): 1.2e-43, (69.80% identity in 308 aa overlap). Also similar to other proteins e.g. Rv3209 from Mycobacterium tuberculosis. Contains PS00499 C2 domain signature, a hydrophobic region, and a repetitive proline and threonine rich region. Belongs to the MmpS family. A core mycobacterial gene; conserved in mycobacterial strains (See Marmiesse et al., 2004).;UniProt_AC=P9WJT1;Is_Pseudogene=No;Functional_Category=cell wall and cell processes;Protein Data Bank=;PFAM=P65378;UniProt=P9WJT1;Gene Ontology=GO:0016021;Enzyme Classification=;Drug Resistance Mutations=;InterPro=;UniProtKB/TrEMBL=;SWISS-MODEL=",mmpS3,Rv2198c,Probable conserved membrane protein MmpS3,cell wall and cell processes,2463233,2463652,2461504,2462148,FALSE,TRUE,TTGGACAGGGTAGGC,GACCGCAAACGAGCT,ATG,-6.61615,7,TRUE,FALSE,-0.359835,7,,1,,A,436,1
CDS,2511176,2511652,-,"Locus=Rv2239c;Name=Rv2239c;Function=Unknown;Product=Conserved hypothetical protein;Comments=Rv2239c, (MTCY427.20c), len: 158 aa. Conserved hypothetical protein, similar to conserved hypothetical proteins from Mycobacterium leprae (ML1649, 140 aa) and Streptomyces coelicolor A3(2) (SCC8A.28c, 159 aa). Equivalent to ML1649 conserved hypothetical protein (140 aa). FASTA scores: ML1649 conserved hypothetical protein (140 aa) opt: 846, E(): 6.5e-45; 86.429% identity in 140 aa overlap (tr|O69479|O69479 hypothetical 15.2 KDA protein (140 aa); and opt: 447, E(): 1.2e-21; 50.355% identity (51.825% ungapped) in 141 aa overlap. Similarity with ML1649 suggests alternative start at 251198.;UniProt_AC=P9WLG9;Is_Pseudogene=No;Functional_Category=conserved hypotheticals;Protein Data Bank=;PFAM=P64959;UniProt=P9WLG9;Gene Ontology=;Enzyme Classification=;Drug Resistance Mutations=;InterPro=;UniProtKB/TrEMBL=;SWISS-MODEL=P9WLG9",Rv2239c,Rv2239c,Conserved hypothetical protein,conserved hypotheticals,2511690,2512280,2510715,2511176,FALSE,TRUE,TTCTGGCTGTGCGAC,CGCGGGCTGGCAAGC,ATG,0.827129999999999,14,FALSE,FALSE,-2.98185,10,,1,,A,438,1
CDS,2594699,2595364,-,"Locus=Rv2322c;Name=rocD1;Function=Involved in arginine metabolism [catalytic activity: L-ornithine + a 2-oxo acid = L-glutamate 5-semialdehyde + an L-amino acid].;Product=Probable ornithine aminotransferase (N-terminus part) RocD1 (ornithine--oxo-acid aminotransferase);Comments=Rv2322c, (MTCY3G12.12), len: 221 aa. Probable rocD1, ornithine aminotransferase, highly similar to N-terminal region of other ornithine aminotransferases, e.g. Q9FC90|ROCD from Streptomyces coelicolor (407 aa), FASTA scores: opt: 770, E(): 8.7e-40, (55.7% identity in 201 aa overlap); BAB42057|ROCD|SA0818 from Staphylococcus aureus subsp. aureus N315 (396 aa) FASTA scores: opt: 632, E(): 2.2e-31, (46.1% identity in 208 aa overlap); P38021|OAT_BACSU|ROCD from Bacillus subtilis (401 aa), FASTA scores: opt: 626, E(): 5.1e-31, (43.1% identity in 218 aa overlap); etc. Belongs to class-III of pyridoxal-phosphate-dependent aminotransferases. Rv2322c|MTCY3G12.12 and Rv2321c|MTCY3G12.13 (upstream ORF) appear to be an ornithine aminotransferase homologue but are frameshifted - we can find no sequence error in the cosmid to account for this.;UniProt_AC=P71890;Is_Pseudogene=No;Functional_Category=intermediary metabolism and respiration;Protein Data Bank=;PFAM=P71890;UniProt=P71890;Gene Ontology=GO:0030170,GO:0004587;Enzyme Classification=2.6.1.13;Drug Resistance Mutations=;InterPro=;UniProtKB/TrEMBL=;SWISS-MODEL=P71890",rocD1,Rv2322c,Probable ornithine aminotransferase (N-terminus part) RocD1 (ornithine--oxo-acid aminotransferase),intermediary metabolism and respiration,2595361,2596269,2594154,2594699,TRUE,TRUE,GCACGCTGGAGATAC,CGTCGAGCACAACGT,ATG,-3.60793,9,TRUE,FALSE,-0.359835,13,4,1,ATGA,A,443,1
CDS,2642578,2643468,-,"Locus=Rv2361c;Name=Rv2361c;Function=Involved in the synthesis of decaprenyl diphosphate, a molecule which has a central role in the biosynthesis of most features of the mycobacterial cell wall. Adds seven more isoprene UNITS to omega,E, Z-farnesyl diphosphate and releases decaprenyl diphosphate.;Product=Long (C50) chain Z-isoprenyl diphosphate synthase (Z-decaprenyl diphosphate synthase);Comments=Rv2361c, (MT2430, MTCY27.19), len: 296 aa. Long (C50) chain Z-isoprenyl diphosphate synthase (see citation below), equivalent to UPPS_MYCLE|ML0634|B1937_F2_65|P38119 undecaprenyl pyrophosphate synthetase from Mycobacterium leprae (296 aa), FASTA scores: opt: 1789, E(): 1.8e-97, (86.5% identity in 296 aa overlap). Also highly similar to others e.g. UPPS|Q9L2H4 undecaprenyl pyrophosphate synthetase from Streptomyces coelicolor (277 aa), FASTA scores: opt: 1098, E(): 8.2e-60, (63.5% identity in 247 aa overlap); Q55482|UPPS_SYNY3|SLL0506 from Synechocystis sp. strain PCC 6803 (249 aa), FASTA scores: opt: 686, E(): 4.2e-33, (46.4% identity in 235 aa overlap); O67291|UPPS_AQUAE|AQ_1248 from Aquifex aeolicus (231 aa), FASTA scores: opt: 684, E(): 5.2e-33, (46.3% identity in 229 aa overlap); etc. Also similar to Rv1086|MTV017.39 from Mycobacterium tuberculosis. Contains PS01066 Hypothetical YBR002c family signature. Seems to belong to the UPP synthetase family. Note that previously known as uppS.;UniProt_AC=P9WFF7;Is_Pseudogene=No;Functional_Category=cell wall and cell processes;Protein Data Bank=2VG2,2VG3,2VG4;PFAM=P60479;UniProt=P9WFF7;Gene Ontology=GO:0051301,GO:0007047,GO:0008834,GO:0009252,GO:0008360,GO:0007049;Enzyme Classification=2.5.1.31;Drug Resistance Mutations=;InterPro=;UniProtKB/TrEMBL=;SWISS-MODEL=P9WFF7",Rv2361c,Rv2361c,Long (C50) chain Z-isoprenyl diphosphate synthase (Z-decaprenyl diphosphate synthase),cell wall and cell processes,2643461,2644258,2642150,2642578,TRUE,TRUE,ATCGGGCAGGATATA,GGCGGTTCGGGAGCG,GTG,-4.49374,10,TRUE,TRUE,-6.19374,5,8,1,GTGGCTAG,G,445,1
