type,start,end,strand,attributes,locus_name,Rv_name,product_name,function_group,prev_start,prev_end,next_start,next_end,overlap_prev,overlap_next,seq_upstream,seq_next_upstream,start_codon,deltaG,RBS_dist,has_RBS,next_has_RBS,next_deltaG,next_RBS_dist,n_overlap_prev,n_overlap_next,seq_overlap_prev,seq_overlap_next,group,frame
CDS,2097647,2097961,+,"Locus=Rv1849;Name=ureB;Function=Involved in the conversion of urea to NH3 [catalytic activity: urea + H2O = CO2 + 2 NH3];Product=Urease beta subunit UreB (urea amidohydrolase);Comments=Rv1849, (MTCY359.24c), len: 104 aa. UreB, urease beta subunit. Identical to URE2_MYCTU|P50048 urease beta subunit from Mycobacterium tuberculosis (100 aa). Belongs to the urease gamma subunit family.;UniProt_AC=P9WFE9;Is_Pseudogene=No;Functional_Category=intermediary metabolism and respiration;Protein Data Bank=;PFAM=P0A662;UniProt=P9WFE9;Gene Ontology=GO:0016151,GO:0006807,GO:0009039,GO:0005737;Enzyme Classification=3.5.1.5;Drug Resistance Mutations=;InterPro=;UniProtKB/TrEMBL=;SWISS-MODEL=P9WFE9",ureB,Rv1849,Urease beta subunit UreB (urea amidohydrolase),intermediary metabolism and respiration,2097348,2097650,2097961,2099694,TRUE,TRUE,CCGTGCATCAGCCGA,CCGGACGGTTGGACC,ATG,1.2151,10,FALSE,TRUE,-5.25299,11,4,1,ATGA,A,194,1
CDS,2097961,2099694,+,"Locus=Rv1850;Name=ureC;Function=Involved in the conversion of urea to NH3 [catalytic activity: urea + H2O = CO2 + 2 NH3];Product=Urease alpha subunit UreC (urea amidohydrolase);Comments=Rv1850, (MTCY359.23c), len: 577 aa. UreC, urease alpha subunit. Similar to URE1_MYCTU|P50042 from Mycobacterium tuberculosis (577 aa), FASTA scores: opt: 3794, E(): 0, (98.3% identity in 577 aa overlap). Contains PS00145 Urease active site motif. Belongs to the urease family.;UniProt_AC=P9WFF1;Is_Pseudogene=No;Functional_Category=intermediary metabolism and respiration;Protein Data Bank=;PFAM=P0A660;UniProt=P9WFF1;Gene Ontology=GO:0016151,GO:0019627,GO:0009039,GO:0005737;Enzyme Classification=3.5.1.5;Drug Resistance Mutations=;InterPro=;UniProtKB/TrEMBL=;SWISS-MODEL=P9WFF1",ureC,Rv1850,Urease alpha subunit UreC (urea amidohydrolase),intermediary metabolism and respiration,2097647,2097961,2099694,2100329,TRUE,TRUE,CCGGACGGTTGGACC,AACGGTATTTCCTGT,ATG,-5.25299,11,TRUE,FALSE,-1.569835,14,1,1,A,A,194,1
CDS,2160463,2161566,+,"Locus=Rv1915;Name=aceAa;Function=Involved in glyoxylate bypass, an alternative to the tricarboxylic acid cycle [catalytic activity: isocitrate = succinate + glyoxylate].;Product=Probable isocitrate lyase AceAa [first part] (isocitrase) (isocitratase) (Icl);Comments=Rv1915, (MTCY180.03c), len: 367 aa. Probable aceAa, isocitrate lyase (see citations below). Highly similar to the N-terminus of ACEA_MYCLE isocitrate lyase from Mycobacterium leprae (606 aa), FASTA results: opt: 3314, E(): 0, (86.5% identity in 572 aa overlap). Contains PS00161 Isocitrate lyase signature. Although this ORF and the downstream ORF representing the C-terminal half of aceA could be joined by a frameshift, no error is apparent in the cosmid, or in a seqencing read from the genome of H37Rv. As the downstream ORF has a RBS and transcriptional start immediately following the stop of this ORF, it is possible that they are expressed as two separate modules. In Mycobacterium tuberculosis strain CDC1551, aceA exists as a single gene, MT1966: the corresponding protein has been purified experimentally and seems have an active isocitrate lyase activity (see Honer et al., 1999). For Mycobacterium tuberculosis strain H37Rv, immunoblot assay didn't detect AceAa or AceAb products (see Honer et al., 1999) but mRNA of AceAa|Rv1915 has been detected (see Betts et al., 2002); so AceAb|Rv1916 could be a pseudogene. Icl2 has 2-methyl-isocitrate lyase (MCL) activity in M. tuberculosis Erdman (See Munoz-Elias et al., 2006).;UniProt_AC=O07718;Is_Pseudogene=No;Functional_Category=intermediary metabolism and respiration;Protein Data Bank=;PFAM=O07718;UniProt=O07718;Gene Ontology=GO:0004451,GO:0019752;Enzyme Classification=4.1.3.1;Drug Resistance Mutations=;InterPro=;UniProtKB/TrEMBL=;SWISS-MODEL=O07718",aceAa,Rv1915,Probable isocitrate lyase AceAa [first part] (isocitrase) (isocitratase) (Icl),intermediary metabolism and respiration,2159191,2159943,2161566,2162762,FALSE,TRUE,TGCAGAGGAGCGCAA,GGAGGACGACGCGGG,ATG,-6.768055,11,TRUE,TRUE,-6.956025,15,,1,,A,195,1
CDS,2388616,2390085,+,"Locus=Rv2127;Name=ansP1;Function=Involved in L-asparagine transport.;Product=L-asparagine permease AnsP1;Comments=Rv2127, (MTCY261.26), len: 489 aa. AnsP1, L-asparagine permease, integral membrane protein similar to many. Contains PS00218 Amino acid permeases signature. Seems to belong to the APC family.;UniProt_AC=P9WQM9;Is_Pseudogene=No;Functional_Category=cell wall and cell processes;Protein Data Bank=;PFAM=O33261;UniProt=P9WQM9;Gene Ontology=GO:0006865,GO:0016021,GO:0005886,GO:0055085,GO:0015171;Enzyme Classification=;Drug Resistance Mutations=;InterPro=;UniProtKB/TrEMBL=;SWISS-MODEL=P9WQM9",ansP1,Rv2127,L-asparagine permease AnsP1,cell wall and cell processes,2386293,2387171,2390085,2390288,FALSE,TRUE,GCCGCCCGAGACTCC,CCGTGAGGTCAAGAG,TTG,-0.359835,10,FALSE,TRUE,-5.904895,11,,1,,A,212,1
CDS,2481965,2483626,+,"Locus=Rv2215;Name=dlaT;Function=Involved in tricarboxylic acid cycle; converts pyruvate to acetyl-CoA and CO2. Also involved in antioxidant defense; LPDC|Rv0462, DLAT|Rv2215, AHPD|Rv2429, and AHPC|Rv2428 constitute an NADH-dependent peroxidase and peroxynitrite reductase that provides protection against oxidative stress.;Product=DlaT, dihydrolipoamide acyltransferase, E2 component of pyruvate dehydrogenase;Comments=Rv2215, (MTCY190.26), len: 553 aa. DlaT, dihydrolipoamide acyltransferase, E2 component of pyruvate dehydrogenase, proven biochemically (see Tian et al. 2005), similar to e.g. SW:O PD2_ACHLA P35489 dihydrolipoamide acetyltransferase component (E2) of pyruvate dehydrogenase complex (35.3% identity in 552 aa overlap); contains PS00189 2-oxo acid dehydrogenases acyltransferase component lipoyl binding site. Rhodanine compounds inhibit DlaT|Rv2215 and can kill non-replicating mycobacteria in mouse bone marrow-derived macrophages (See Bryk et al., 2008). LpdC|Rv0462 co-immunoprecipitates with DlaT|Rv2215 (in lpdC|Rv0462 mutant) and with BkdC|Rv2495c (in dlaT|Rv2215 mutant) (See Venugopal et al., 2011).;UniProt_AC=P9WIS7;Is_Pseudogene=No;Functional_Category=intermediary metabolism and respiration;Protein Data Bank=;PFAM=P65633;UniProt=P9WIS7;Gene Ontology=GO:0004149,GO:0031405,GO:0005515,GO:0006099,GO:0016209;Enzyme Classification=2.3.1.61;Drug Resistance Mutations=;InterPro=;UniProtKB/TrEMBL=;SWISS-MODEL=P9WIS7",dlaT,Rv2215,"DlaT, dihydrolipoamide acyltransferase, E2 component of pyruvate dehydrogenase",intermediary metabolism and respiration,2478338,2479885,2483626,2484531,FALSE,TRUE,GATCGAGGAGTCAAC,AGGCCGATTTAGGAC,ATG,-6.768055,11,TRUE,TRUE,-4.20793,7,,1,,A,215,1
CDS,2507146,2507637,+,"Locus=Rv2234;Name=ptpA;Function=Involved in signal transduction (via dephosphorylation). Can dephosphorylated in vitro the phosphotyrosine residue of myelin basic protein (MBP) at pH 7.0 [catalytic activity: protein tyrosine phosphate + H(2)O = protein tyrosine + phosphate].;Product=Phosphotyrosine protein phosphatase PtpA (protein-tyrosine-phosphatase) (PTPase) (LMW phosphatase);Comments=Rv2234, (MTCY427.15), len: 163 aa. PtpA (alternate gene name: MPtpA), low molecular weight protein-tyrosine-phosphatase (see citations below), similar to other phosphotyrosine protein phosphatases e.g. P53433|PTPA_STRCO low molecular weight protein-tyrosine phosphatase from Streptomyces coelicolor (164 aa), FASTA scores: opt: 455, E(): 3.3e -25, (49.7% identity in 155 aa overlap); PA1S_HUMAN|P24667 red cell acid phosphatase 1, FASTA score: (37.7% identity in 138 aa overlap); etc. Contains a phosphatase catalytic site domain located in N-terminal part. Activity proven biochemically. Supposed a secreted protein. Substrate of PtkA|Rv2232.;UniProt_AC=P9WIA1;Is_Pseudogene=No;Functional_Category=regulatory proteins;Protein Data Bank=1U2P,1U2Q,1ZOJ;PFAM=P65716;UniProt=P9WIA1;Gene Ontology=GO:0004725,GO:0006470;Enzyme Classification=3.1.3.48;Drug Resistance Mutations=;InterPro=;UniProtKB/TrEMBL=;SWISS-MODEL=P9WIA1",ptpA,Rv2234,Phosphotyrosine protein phosphatase PtpA (protein-tyrosine-phosphatase) (PTPase) (LMW phosphatase),regulatory proteins,2506278,2507153,2507637,2508452,TRUE,TRUE,GAGCTGAGGGAGGCG,CGCGGAACGGACCGA,GTG,-8.39374,7,TRUE,TRUE,-3.756025,10,8,1,GTGTCTGA,A,217,1
CDS,2532245,2533330,+,"Locus=Rv2259;Name=mscR;Function=Involved in the reduction of S-nitroglutathione;Product=S-nitrosomycothiol reductase MscR;Comments=Rv2259, (MTV022.09), len: 361 aa. MscR, S-nitrosomycothiol reductase (see Vogt et al., 2003), similar to several zinc-containing alcohol dehydrogenases especially from Amycolatopsis methanolica P80094 (360 aa), FASTA scores: sp|P80094|FADH_AMYME NAD/mycothiol-dependent formaldehyde dehydrogenase (MD-FALDH) Length = 360, Expect = e-156, Identities = 268/358 (74%). Also similar to Rv0162c, (MTCI28.02c, 35.0% identity in 371 aa overlap). Contains PS00059 Zinc-containing alcohol dehydrogenases signature. Note previously known as adhE2;UniProt_AC=O53533;Is_Pseudogene=No;Functional_Category=intermediary metabolism and respiration;Protein Data Bank=;PFAM=O53533;UniProt=O53533;Gene Ontology=GO:0016491,GO:0008270,GO:0055114;Enzyme Classification=1.2.1.-;Drug Resistance Mutations=;InterPro=;UniProtKB/TrEMBL=;SWISS-MODEL=O53533",mscR,Rv2259,S-nitrosomycothiol reductase MscR,intermediary metabolism and respiration,2527984,2528487,2533330,2533965,FALSE,TRUE,ACACCGTAGGTTGGA,GTTCGGTGGTGATGT,ATG,-3.82996,9,TRUE,FALSE,-1.469835,13,,1,,A,220,1
CDS,2773178,2773564,+,"Locus=Rv2470;Name=glbO;Function=Oxygen carrier, involved in oxygen transport.;Product=Globin (oxygen-binding protein) GlbO;Comments=Rv2470, (MTV008.26), len: 128 aa. glbO, globin-like protein, highly similar to Q9CC59|GLBO|ML1253 hemoglobin-like (oxygen carrier) from Mycobacterium leprae (128 aa), FASTA scores: opt: 767, E(): 4e-47, (88.1% identity in 126 aa overlap); Q9X7B3|MLCB1610.14c putative globin from Mycobacterium leprae (131 aa); Q9L250|SC6D10.14 putative globin from Streptomyces coelicolor (137 aa), FASTA scores: opt: 466, E(): 5.7e-26, (53.6% identity in 125 aa overlap). Also similar to O31607 YJBI protein from Bacillus subtilis (132 aa), FASTA scores: opt: 294, E(): 6.6e-14; (39.85% identity in 128 aa overlap). Could belong to protozoan/cyanobacterial globin family protein.;UniProt_AC=P9WN23;Is_Pseudogene=No;Functional_Category=intermediary metabolism and respiration;Protein Data Bank=1NGK,2QRW;PFAM=P0A595;UniProt=P9WN23;Gene Ontology=GO:0019825,GO:0015671,GO:0005344,GO:0005886,GO:0020037;Enzyme Classification=;Drug Resistance Mutations=;InterPro=;UniProtKB/TrEMBL=;SWISS-MODEL=P9WN23",glbO,Rv2470,Globin (oxygen-binding protein) GlbO,intermediary metabolism and respiration,2768986,2771571,2773564,2775204,FALSE,TRUE,AATGGAGGGGATGGA,TGGTCAACTCCCCGT,ATG,-6.856025,12,TRUE,FALSE,-1.469835,16,,1,,A,230,1
CDS,2886373,2889795,+,"Locus=Rv2566;Name=Rv2566;Function=Function unknown;Product=Long conserved protein;Comments=Rv2566, (MTCY9C4.02c), len: 1140 aa. Long conserved protein, equivalent to O53120|ML2678 or MLCB1913.12 hypothetical protein from Mycobacterium leprae (1000 aa), FASTA scores: opt: 760, E(): 7.1e-38, (50.2% identity in 1128 aa overlap); and middle part equivalent to Q9ZB40 72.2 KDA protein (fragment) from Mycobacterium leprae (644 aa), FASTA scores: opt: 1017, E(): 1.5e-65, (45.65% identity in 655 aa overlap). Also highly similar to Q98HG6|MLL2877 hypothetical protein from Rhizobium loti (Mesorhizobium loti) (1119 aa), FASTA scores: opt: 1413, E(): 3.7e-77, (52.4% identity in 1148 aa overlap); and N-terminus shows similarity with other proteins e.g. Q9HUN8|PA4926 hypothetical protein from Pseudomonas aeruginosa (311 aa), FASTA scores: opt: 278, E(): 3e-09, (29.95% identity in 284 aa overlap); and upstream ORF Q50652|YP69_MYCTU|Rv2569c|MT2645|MTCY227.32 conserved hypothetical protein from Mycobacterium tuberculosis (314 aa), FASTA scores: opt: 252, E(): 1.1e-07, (28.9% identity in 315 aa overlap). Equivalent to AAK46955 from Mycobacterium tuberculosis strain CDC1551 (1156 aa) but shorter 16 aa.;UniProt_AC=Q50732;Is_Pseudogene=No;Functional_Category=conserved hypotheticals;Protein Data Bank=;PFAM=Q50732;UniProt=Q50732;Gene Ontology=;Enzyme Classification=;Drug Resistance Mutations=;InterPro=;UniProtKB/TrEMBL=;SWISS-MODEL=Q50732",Rv2566,Rv2566,Long conserved protein,conserved hypotheticals,2884611,2886362,2889795,2892449,FALSE,TRUE,GTGCGCTGAACCCGA,TGCGTACCGTGCAAC,GTG,1.57826,18,FALSE,FALSE,1.67826,15,,1,,A,235,1
CDS,3288464,3289705,+,"Locus=Rv2943;Name=Rv2943;Function=Required for the transposition of the insertion element IS1533.;Product=Probable transposase for insertion sequence element IS1533;Comments=Rv2943, (MTCY24G1.06c), len: 413 aa. Probable transposase for insertion sequence IS1533, similar to other transposases e.g. P15025|ISTA_ECOLI ista protein (insertion sequence IS21) from Escherichia coli (390 aa), FASTA scores: opt: 268, E(): 5.1e-11, (24.1% identity in 378 aa overlap). Contains potential helix-turn-helix motif at aa 19-40 (Score 1611, +4.67 SD).;UniProt_AC=I6X5T4;Is_Pseudogene=No;Functional_Category=insertion seqs and phages;Protein Data Bank=;PFAM=P96288;UniProt=I6X5T4;Gene Ontology=GO:0006355,GO:0016987,GO:0003700,GO:0006352,GO:0015074;Enzyme Classification=;Drug Resistance Mutations=;InterPro=;UniProtKB/TrEMBL=;SWISS-MODEL=I6X5T4",Rv2943,Rv2943,Probable transposase for insertion sequence element IS1533,insertion seqs and phages,3285070,3287832,3289705,3290235,FALSE,TRUE,GCCAGGAGGACCGAA,TCGATGGCGGGGTGG,ATG,-9.71615,12,TRUE,TRUE,-5.419565,5,,1,,A,254,1
CDS,3512628,3513338,+,"Locus=Rv3147;Name=nuoC;Function=Involved in aerobic|anaerobic respiration [catalytic activity: NADH + ubiquinone = NAD(+) + ubiquinol].;Product=Probable NADH dehydrogenase I (chain C) NuoC (NADH-ubiquinone oxidoreductase chain C);Comments=Rv3147, (MTCY03A2.11c), len: 236 aa. Probable nuoC, NADH dehydrogenase, chain C, similar to others e.g. Q9XAQ6|NUOC from Streptomyces coelicolor (251 aa), FASTA scores: opt: 1113, E(): 2.6e-64, (67.35% identity in 236 aa overlap); Q9A6X2|CC1954 from Caulobacter crescentus (197 aa), FASTA scores: opt: 351, E(): 1.6e-15, (41.65% identity in 132 aa overlap); BAB48757|MLL1369 from Rhizobium loti (Mesorhizobium loti) (201 aa), FASTA scores: opt: 347, E(): 3e-15, (42.4% identity in 132 aa overlap); etc. Also similar to Q9UUU0|NUGM NUGM protein precursor from Yarrowia lipolytica (Candida lipolytica) (281 aa), FASTA scores: opt: 356, E(): 1.1e-15, (34.55% identity in 162 aa overlap). Also similar to MTCY251.05, FASTA score: E():4.9e-05. Equivalent to AAK47574 from Mycobacterium tuberculosis strain CDC1551 but longer 26 aa. Belongs to the complex I 30 KDA subunit family.;UniProt_AC=P9WJH3;Is_Pseudogene=No;Functional_Category=intermediary metabolism and respiration;Protein Data Bank=;PFAM=P65571;UniProt=P9WJH3;Gene Ontology=GO:0055114,GO:0019684,GO:0005886,GO:0048038,GO:0006810,GO:0008137;Enzyme Classification=1.6.99.5;Drug Resistance Mutations=;InterPro=;UniProtKB/TrEMBL=;SWISS-MODEL=P9WJH3",nuoC,Rv3147,Probable NADH dehydrogenase I (chain C) NuoC (NADH-ubiquinone oxidoreductase chain C),intermediary metabolism and respiration,3512077,3512631,3513338,3514660,TRUE,TRUE,AGATGCGCGGACTGC,AGCGGAGGGGCTACA,ATG,-1.247805,9,FALSE,TRUE,-6.856025,12,4,1,ATGA,A,264,1
CDS,3536102,3537238,+,"Locus=Rv3168;Name=Rv3168;Function=Confers resistance to aminoglycoside antibiotics;Product=Putative aminoglycoside phosphotransferase;Comments=Rv3168, (MTV014.12), len: 378 aa. Putative aminoglycoside phosphotransferase, similar to hypothetical proteins e.g. Q9M7Y6|F3E22.6 from Arabidopsis thaliana (Mouse-ear cress) (314 aa), FASTA scores: opt: 236, E(): 1.1e-07, (27.35% identity in 234 aa overlap); Q9RYW2|DRA0194 from Deinococcus radiodurans (386 aa), FASTA scores: opt: 207, E(): 9.1e-06, (23.45% identity in 320 aa overlap); etc. Also some similarity with O69727|Rc3761c|MTV025.109c hypothetical protein from Mycobacterium tuberculosis (351 aa), FASTA scores: opt: 193, E(): 6.4e-05, (29.4% identity in 242 aa overlap).;UniProt_AC=P9WI99;Is_Pseudogene=No;Functional_Category=virulence, detoxification, adaptation;Protein Data Bank=3ATS,3ATT;PFAM=O53318;UniProt=P9WI99;Gene Ontology=;Enzyme Classification=;Drug Resistance Mutations=;InterPro=;UniProtKB/TrEMBL=;SWISS-MODEL=P9WI99",Rv3168,Rv3168,Putative aminoglycoside phosphotransferase,"virulence, detoxification, adaptation",3525790,3527385,3537238,3538362,FALSE,TRUE,CCGCACCAGGGAGGC,TTCTTGGAGAGGAGC,GTG,-8.39374,6,TRUE,TRUE,-6.768055,7,,1,,A,267,1
CDS,3705000,3706772,+,"Locus=Rv3318;Name=sdhA;Function=Involved in tricarboxylic acid cycle. Membrane-bound FAD-containing enzyme which is responsible for succinate interconversion [catalytic activity: succinate + acceptor = fumarate + reduced acceptor].;Product=Probable succinate dehydrogenase (flavoprotein subunit) SdhA (succinic dehydrogenase) (fumarate reductase) (fumarate dehydrogenase) (fumaric hydrogenase);Comments=Rv3318, (MTV016.18), len: 590 aa. Probable sdhA, flavoprotein of succinate dehydrogenase SdhA subunit, equivalent to Q9CCM1|SDHA|ML0697 succinate dehydrogenase flavoprotein subunit from Mycobacterium leprae (584 aa), FASTA scores: opt: 3657, E(): 1.2e-217, (92.55% identity in 590 aa overlap). Also highly similar to others e.g. Q9KZ90|DHSA from Streptomyces coelicolor (584 aa), FASTA scores: opt: 2813, E(): 1.1e-165, (70.5% identity in 586 aa overlap); Q9RVS0|DR0952 from Deinococcus radiodurans (583 aa), FASTA scores: opt: 2203, E(): 4.1e-128, (57.35% identity in 593 aa overlap); P31038|DHSA_RICPR|SDHA|RP128 from Rickettsia prowazekii (596 aa), FASTA scores: opt: 1892, E(): 5.8e-109, (50.0% identity in 588 aa overlap); P10444|DHSA_ECOLI|SDHA|B0723|Z0877|ECS0748 from Escherichia coli strains K12 and O157:H7 (588 aa), FASTA scores: opt: 1844, E(): 5.2e-106, (48.75% identity in 591 aa overlap); etc. Contains PS00504 Fumarate reductase / succinate dehydrogenase FAD-binding site. Cofactor: FAD. Similar to the flavoprotein subunits of other species succinate dehydrogenase and of fumarate reductase. Part of an enzyme complex containing four subunits: a flavoprotein, an iron-sulfur, cytochrome B-556, and an hydrophobic anchor protein.;UniProt_AC=O53370;Is_Pseudogene=No;Functional_Category=intermediary metabolism and respiration;Protein Data Bank=;PFAM=O53370;UniProt=O53370;Gene Ontology=GO:0009055,GO:0022900,GO:0000104,GO:0006099,GO:0050660;Enzyme Classification=1.3.99.1;Drug Resistance Mutations=;InterPro=;UniProtKB/TrEMBL=;SWISS-MODEL=O53370",sdhA,Rv3318,Probable succinate dehydrogenase (flavoprotein subunit) SdhA (succinic dehydrogenase) (fumarate reductase) (fumarate dehydrogenase) (fumaric hydrogenase),intermediary metabolism and respiration,3704437,3704871,3706772,3707563,FALSE,TRUE,TGCATCGTCGGCGGC,CCAAGGAACGGAAGT,TTG,0.827129999999999,9,FALSE,TRUE,-6.91615,10,,1,,A,280,1
CDS,3908072,3908236,+,"Locus=Rv3489;Name=Rv3489;Function=Unknown;Product=Unknown protein;Comments=Rv3489, (MTCY13E12.42), len: 54 aa. Unknown protein. No similarity with other proteins.;UniProt_AC=I6YC91;Is_Pseudogene=No;Functional_Category=conserved hypotheticals;Protein Data Bank=;PFAM=;UniProt=I6YC91;Gene Ontology=;Enzyme Classification=;Drug Resistance Mutations=;InterPro=;UniProtKB/TrEMBL=;SWISS-MODEL=I6YC91",Rv3489,Rv3489,Unknown protein,conserved hypotheticals,3907667,3907990,3908236,3909738,FALSE,TRUE,CTTGGCTTACAGTTA,CGGCCAAACTCGAGA,ATG,0.827129999999999,15,FALSE,FALSE,-0.359835,6,,1,,A,291,1
CDS,3989153,3989896,+,"Locus=Rv3550;Name=echA20;Function=Could possibly oxidize fatty acids using specific components [catalytic activity: (3S)-3-hydroxyacyl-CoA = trans-2(or 3)-enoyl-CoA + H(2)O].;Product=Probable enoyl-CoA hydratase EchA20 (enoyl hydrase) (unsaturated acyl-CoA hydratase) (crotonase);Comments=Rv3550, (MTCY03C7.06c), len: 247 aa. Probable echA20, enoyl-CoA hydratase, similar to others e.g. Q9A7B0|CC1814 from Caulobacter crescentus (275 aa), FASTA scores: opt: 488, E(): 3.5e-24, (36.4% identity in 239 aa overlap); O84978|PHAA from Pseudomonas putida (293 aa), FASTA scores: opt: 383, E(): 2e-17, (33.85% identity in 254 aa overlap); BAB48479|Q98LI4|MLL1009 from Rhizobium loti (Mesorhizobium loti) (258 aa), FASTA scores: opt: 378, E(): 3.8e-17, (21.45% identity in 231 aa overlap); etc. Could belong to the enoyl-CoA hydratase/isomerase family.;UniProt_AC=I6Y3U6;Is_Pseudogene=No;Functional_Category=lipid metabolism;Protein Data Bank=;PFAM=P71851;UniProt=I6Y3U6;Gene Ontology=GO:0016853,GO:0008152,GO:0004300;Enzyme Classification=4.2.1.17;Drug Resistance Mutations=;InterPro=;UniProtKB/TrEMBL=;SWISS-MODEL=I6Y3U6",echA20,Rv3550,Probable enoyl-CoA hydratase EchA20 (enoyl hydrase) (unsaturated acyl-CoA hydratase) (crotonase),lipid metabolism,3986844,3987299,3989896,3990774,FALSE,TRUE,GCGAACCCGCAGGAG,CCTTTGTGAAGAAGT,ATG,-7.268055,6,TRUE,FALSE,0.9151,10,,1,,G,293,1
CDS,4076484,4076984,+,"Locus=Rv3637;Name=Rv3637;Function=Possibly required for the transposition of an insertion element.;Product=Possible transposase;Comments=Rv3637, (MTCY15C10.15c), len: 166 aa. Possible transposase. C-terminal end highly similar to Q9RLQ9|ISTA putative transposase a (fragment) from Mycobacterium bovis (102 aa), FASTA scores: opt: 397, E(): 1.4e-19, (58.8% identity in 102 aa overlap). Weakly similar to others e.g. Q9KJ02 putative transposase (fragment) from Polyangium cellulosum (329 aa), FASTA scores: opt: 191, E(): 1.6e-05, (32.1% identity in 134 aa overlap); Q9LCU2|ISTA cointegrase from Pseudomonas aeruginosa (382 aa) FASTA scores: opt: 144, E(): 0.024, (26.8% identity in 123 aa overlap); P15025|ISTA_PSEAE transposase for insertion sequence element IS21 from Pseudomonas aeruginosa (390 aa), FASTA scores: opt: 144, E(): 0.025, (26.85% identity in 123 aa overlap); etc. Also highly similar to C-terminal end of P96288|Rv2943|MTCY24G1.06c hypothetical 45.8 KDA protein from Mycobacterium tuberculosis (413 aa) FASTA scores: opt: 722, E(): 1.5e-40, (63.7% identity in 168 aa overlap).;UniProt_AC=O06370;Is_Pseudogene=No;Functional_Category=insertion seqs and phages;Protein Data Bank=;PFAM=;UniProt=O06370;Gene Ontology=;Enzyme Classification=;Drug Resistance Mutations=;InterPro=;UniProtKB/TrEMBL=;SWISS-MODEL=O06370",Rv3637,Rv3637,Possible transposase,insertion seqs and phages,4075752,4076099,4076984,4077730,FALSE,TRUE,CTACCTGGAGCGGGC,TTGACGGGCCGGTGG,TTG,-3.756025,7,TRUE,TRUE,-5.278815,7,,1,,A,299,1
CDS,4237932,4239863,+,"Locus=Rv3792;Name=aftA;Function=Involved in the biosynthesis of the mycobacterial cell wall arabinan;Product=Arabinofuranosyltransferase AftA;Comments=Rv3792, (MTCY13D12.26), len: 643 aa. aftA, arabinofuranosyltransferase (See Alderwick et al., 2006). Predicted to be in the GT-C superfamily of glycosyltransferases (See Liu and Mushegian, 2003). Probable conserved transmembrane protein, equivalent, but longer 21 aa, to Q9CDA6|ML0107 putative membrane protein from Mycobacterium leprae (632 aa), FASTA scores: opt: 1981, E(): 2.1e-110, (77.5% identity in 631 aa overlap). C-terminal end highly similar to C-terminus of O05765 putative product ORF 3 from Mycobacterium smegmatis (603 aa), FASTA scores: opt: 1261, E(): 1.4e-67, (70.7% identity in 266 aa overlap). A core mycobacterial gene; conserved in mycobacterial strains (See Marmiesse et al., 2004).;UniProt_AC=P9WN03;Is_Pseudogene=No;Functional_Category=cell wall and cell processes;Protein Data Bank=;PFAM=P72058;UniProt=P9WN03;Gene Ontology=GO:0007047,GO:0016021,GO:0005886,GO:0046677,GO:0016757,GO:0044038;Enzyme Classification=2.4.2.-;Drug Resistance Mutations=;InterPro=;UniProtKB/TrEMBL=;SWISS-MODEL=P9WN03",aftA,Rv3792,Arabinofuranosyltransferase AftA,cell wall and cell processes,4237165,4237929,4239863,4243147,FALSE,TRUE,GCAAGCTGCCCATCT,AGCCGCAGGAGAGCG,ATG,0.9151,16,FALSE,TRUE,-7.91615,6,,1,,A,305,1
CDS,4345039,4346481,+,"Locus=Rv3869;Name=eccB1;Function=Unknown;Product=ESX conserved component EccB1. ESX-1 type VII secretion system protein. Possible membrane protein.;Comments=Rv3869, (MTV027.04), len: 480 aa. EccB1, esx conserved component, ESX-1 type VII secretion system protein, possible membrane protein (has hydrophobic stretch near N-terminus), equivalent to O33088|ML0054|MLCB628.17c putative membrane protein from Mycobacterium leprae (481 aa), FASTA scores: opt: 2489, E(): 8.3e-136, (75.75% identity in 478 aa overlap); and similar to others e.g. Q9Z5I3|ML1544|MLCB596.27 conserved membrane protein from Mycobacterium leprae (506 aa), FASTA scores: opt: 739, E(): 3.9e-35, (33.65% identity in 490 aa overlap). Also similar to hypothetical proteins from Mycobacterium tuberculosis e.g. O05449|Rv3895c|MTCY15F10.17 (495 aa), FASTA scores: opt: 795, E(): 2.3e-38, (35.8% identity in 486 aa overlap); O53933|Rv1782|MTV049.04 (506 aa), FASTA scores: opt: 763, E(): 1.6e-36, (34.7% identity in 490 aa overlap); O06317|Rv3450c|MTCY13E12.03c (470 aa) FASTA scores: opt: 717, E(): 6.7e-34, (32.55% identity in 479 aa overlap); etc. A core mycobacterial gene; conserved in mycobacterial strains (See Marmiesse et al., 2004).;UniProt_AC=P9WNR7;Is_Pseudogene=No;Functional_Category=cell wall and cell processes;Protein Data Bank=;PFAM=O69734;UniProt=P9WNR7;Gene Ontology=GO:0005886,GO:0016021;Enzyme Classification=;Drug Resistance Mutations=;InterPro=;UniProtKB/TrEMBL=;SWISS-MODEL=P9WNR7",eccB1,Rv3869,ESX conserved component EccB1. ESX-1 type VII secretion system protein. Possible membrane protein.,cell wall and cell processes,4343314,4345035,4346481,4348724,FALSE,TRUE,CAACATGAGAGAATG,GAGCCTCCGGAGCCC,ATG,-0.359835,11,FALSE,TRUE,-3.60793,8,,1,,A,310,1
