type,start,end,strand,attributes,locus_name,Rv_name,product_name,function_group,prev_start,prev_end,next_start,next_end,overlap_prev,overlap_next,seq_upstream,seq_next_upstream,start_codon,deltaG,RBS_dist,has_RBS,next_has_RBS,next_deltaG,next_RBS_dist,n_overlap_prev,n_overlap_next,seq_overlap_prev,seq_overlap_next,group,frame
CDS,311514,312659,-,"Locus=Rv0260c;Name=Rv0260c;Function=Could be involved in transcriptional mechanism.;Product=Possible transcriptional regulatory protein;Comments=Rv0260c, (MTCY0A4.04c), len: 381 aa. Possible two-component response regulator, highly similar to CAB72204.1|AL138851 putative transcriptional regulator from Streptomyces coelicolor (395 aa); and similar to O34394|D69851|YJJA conserved hypothetical protein from Bacillus subtilis (270 aa), FASTA scores: opt: 312, E(): 7.4e-14, (25.8% identity in 267 aa overlap). Also some similarity to regulatory proteins at C-terminal region e.g. CUTR_STRLI|Q03756 transcriptional regulatory protein (217 aa), FASTA scores: opt: 138, E(): 0.02, (30.6% identity in 111 aa overlap).;UniProt_AC=P95217;Is_Pseudogene=No;Functional_Category=regulatory proteins;Protein Data Bank=;PFAM=P95217;UniProt=P95217;Gene Ontology=GO:0005622,GO:0006355,GO:0033014,GO:0000156,GO:0000160,GO:0004852,GO:0003677;Enzyme Classification=;Drug Resistance Mutations=;InterPro=;UniProtKB/TrEMBL=;SWISS-MODEL=P95217",Rv0260c,Rv0260c,Possible transcriptional regulatory protein,regulatory proteins,312759,314168,310774,311517,FALSE,TRUE,ACAGGCCTAGACACG,ACAGCCGGCACGATG,ATG,-3.71615,6,TRUE,FALSE,0.827129999999999,12,,4,,ATGA,320,1
CDS,329705,330325,-,"Locus=Rv0273c;Name=Rv0273c;Function=Could be involved in transcriptional mechanism.;Product=Possible transcriptional regulatory protein;Comments=Rv0273c, (MTV035.01c), len: 206 aa (start uncertain). Possible transcriptional regulator, showing some similarity to hypothetical regulators from Mycobacterium tuberculosis e.g. P96222|Rv3855|MTCY01A6.13c (216 aa); O08377|Rv1534|MTCY07A7A.03 (225 aa), FASTA scores: opt: 123, E(): 3.2e-06, (28.5% identity in 172 aa overlap).;UniProt_AC=O86342;Is_Pseudogene=No;Functional_Category=regulatory proteins;Protein Data Bank=;PFAM=O86342;UniProt=O86342;Gene Ontology=GO:0006350,GO:0003700,GO:0006355;Enzyme Classification=;Drug Resistance Mutations=;InterPro=;UniProtKB/TrEMBL=;SWISS-MODEL=O86342",Rv0273c,Rv0273c,Possible transcriptional regulatory protein,regulatory proteins,330933,331658,328575,329708,FALSE,TRUE,GTTCCAGGGAGGTGC,GTAAGGAGGACAGCT,GTG,-10.690705,7,TRUE,TRUE,-10.01615,12,,4,,TTGA,321,1
CDS,435471,436769,-,"Locus=Rv0357c;Name=purA;Function=Involved in AMP biosynthesis (first committed step). Plays an important role in the de novo pathway of purine nucleotide biosynthesis [catalytic activity: GTP + imp + L-aspartate = GDP + phosphate + adenylosuccinate].;Product=Probable adenylosuccinate synthetase PurA (imp--aspartate ligase) (ADSS) (ampsase);Comments=Rv0357c, (MTCY13E10.19c), len: 432 aa. Probable purA, adenylosuccinate synthase, equivalent to AL023514|MLCB4_13 from adenylosuccinate synthetase Mycobacterium leprae (432 aa), FASTA scores: opt: 2555, E(): 0, (87.9% identity in 431 aa overlap). Also highly similar to many bacterial adenylosuccinates synthetases e.g. P12283|PURA_ECOLI adenylosuccinates synthetase from Escherichia coli (431 aa), FASTA scores: E(): 0, (51.1% identity in 425 aa overlap); etc. Belongs to the adenylosuccinate synthetase family.;UniProt_AC=P9WHN3;Is_Pseudogene=No;Functional_Category=intermediary metabolism and respiration;Protein Data Bank=;PFAM=P65880;UniProt=P9WHN3;Gene Ontology=GO:0004019,GO:0005737,GO:0000287,GO:0006164,GO:0005525;Enzyme Classification=6.3.4.4;Drug Resistance Mutations=;InterPro=;UniProtKB/TrEMBL=;SWISS-MODEL=P9WHN3",purA,Rv0357c,Probable adenylosuccinate synthetase PurA (imp--aspartate ligase) (ADSS) (ampsase),intermediary metabolism and respiration,438302,438739,434830,435474,FALSE,TRUE,GACCAGGTGGGAGCA,ACGTCCTGCAGGATC,ATG,-5.145645,7,TRUE,TRUE,-4.10793,8,,4,,GTGA,322,1
CDS,448040,448633,-,"Locus=Rv0371c;Name=Rv0371c;Function=Function unknown;Product=Conserved hypothetical protein;Comments=Rv0371c, (MTV036.06c), len: 197 aa. Conserved hypothetical protein, similar to other hypothetical proteins e.g. AL132824|SCAH10.09c|CAB60163.1|AL132824 hypothetical protein from Streptomyces coelicolor (207 aa), FASTA scores: opt: 247, E(): 4.5e-09, (32.3% identity in 195 aa overlap). Also weak similarity with YURE|D70017|Z99120|BSUB0017_134 hypothetical protein yurE from Bacillus subtilis (197 aa), FASTA scores: opt: 217, E(): 2.5e-08, (27.0% identity in 174 aa overlap).;UniProt_AC=I6WY86;Is_Pseudogene=No;Functional_Category=conserved hypotheticals;Protein Data Bank=2WE9,2WEE,2YES;PFAM=;UniProt=I6WY86;Gene Ontology=;Enzyme Classification=;Drug Resistance Mutations=;InterPro=;UniProtKB/TrEMBL=;SWISS-MODEL=I6WY86",Rv0371c,Rv0371c,Conserved hypothetical protein,conserved hypotheticals,448630,449385,447147,448043,TRUE,TRUE,CGGACGAGAACGGCG,TGCTGGAATCGGTGC,ATG,-1.656025,7,FALSE,TRUE,-5.65299,7,4,4,ATGA,GTGA,322,1
CDS,448630,449385,-,"Locus=Rv0372c;Name=Rv0372c;Function=Function unknown;Product=Conserved hypothetical protein;Comments=Rv0372c, (MTV036.07c), len: 251 aa. Conserved hypothetical protein, showing some similarity with CAB76248.1|X82447|COXF CoxF protein from Pseudomonas/Oligotropha carboxidovorans (280 aa); AJ224684|BJAJ4684_6 cooxS from Bradyrhizobium japonicum (176 aa), FASTA scores: opt: 186, E(): 1.6e-05, (41.1% identity in 95 aa overlap). Also similar to upstream ORF Rv0376c from Mycobacterium tuberculosis (380 aa), FASTA scores: E(): 6.8e-07, (31.0% identity in 277 aa overlap).;UniProt_AC=O53707;Is_Pseudogene=No;Functional_Category=conserved hypotheticals;Protein Data Bank=;PFAM=O53707;UniProt=O53707;Gene Ontology=;Enzyme Classification=;Drug Resistance Mutations=;InterPro=;UniProtKB/TrEMBL=;SWISS-MODEL=O53707",Rv0372c,Rv0372c,Conserved hypothetical protein,conserved hypotheticals,449404,451803,448040,448633,FALSE,TRUE,GGGGAGCTCGAGGGC,CGGACGAGAACGGCG,ATG,-5.145645,14,TRUE,FALSE,-1.656025,7,,4,,ATGA,323,1
CDS,451800,452279,-,"Locus=Rv0374c;Name=Rv0374c;Function=Function unknown; probably involved in cellular metabolism [catalytic activity: CO + H(2)O + acceptor = CO(2) + reduced acceptor].;Product=Probable carbon monoxyde dehydrogenase (small chain);Comments=Rv0374c, (MTV036.09c), len: 159 aa. Probable carbon monoxide dehydrogenase, small chain, highly similar to others e.g. B56279|5822285|X82447|OCCOXMSL4_2|COXS carbon-monoxide dehydrogenase small chain from Pseudomonas/Oligotropha carboxydovorans (166 aa), FASTA scores: opt: 662, E(): 0, (59.3% identity in 150 aa overlap); CAA12063.1|AJ224684 putative carbon monoxide dehydrogenase small subunit from Bradyrhizobium japonicum (161 aa); S49123|509390|CAA54901.1|X77931|CUTC carbon-monoxide dehydrogenase small chain from Pseudomonas thermocarboxydovorans (163 aa); etc.;UniProt_AC=O53709;Is_Pseudogene=No;Functional_Category=intermediary metabolism and respiration;Protein Data Bank=;PFAM=O53709;UniProt=O53709;Gene Ontology=GO:0009055,GO:0051536,GO:0046872,GO:0055114,GO:0018492;Enzyme Classification=1.2.99.2;Drug Resistance Mutations=;InterPro=;UniProtKB/TrEMBL=;SWISS-MODEL=O53709",Rv0374c,Rv0374c,Probable carbon monoxyde dehydrogenase (small chain),intermediary metabolism and respiration,452294,453154,449404,451803,FALSE,TRUE,CCTGAGAGGGGAACC,AGACCGTAAAGGCGC,ATG,-5.99388,10,TRUE,FALSE,-2.332995,9,,4,,ATGA,324,1
CDS,483228,483656,-,"Locus=Rv0403c;Name=mmpS1;Function=Unknown;Product=Probable conserved membrane protein MmpS1;Comments=Rv0403c, (MTCY04D9.16c), len: 142 aa. Probable mmpS1, conserved membrane protein (see citation below), highly similar to other Mycobacterial proteins e.g. YV33_MYCLE|P54880 hypothetical 16.9 kDa protein from Mycobacterium leprae (154 aa), FASTA scores: opt: 458, E(): 1.6e-26, (46.9% identity in 143 aa overlap); YV33_MYCTU|Q11170 hypothetical 15.9 kDa protein from Mycobacterium tuberculosis (147 aa), FASTA scores: opt: 362, E(): 1.1e-19, (42.1% identity in 140 aa overlap); etc. Also similar to other MmpS proteins from Mycobacterium tuberculosis e.g. Rv0677c, Rv0451c, etc. Belongs to the MmpS family. Predicted to be an outer membrane protein (See Song et al., 2008).;UniProt_AC=P9WJT5;Is_Pseudogene=No;Functional_Category=cell wall and cell processes;Protein Data Bank=;PFAM=P0A5K0;UniProt=P9WJT5;Gene Ontology=GO:0005886,GO:0016021;Enzyme Classification=;Drug Resistance Mutations=;InterPro=;UniProtKB/TrEMBL=;SWISS-MODEL=P9WJT5",mmpS1,Rv0403c,Probable conserved membrane protein MmpS1,cell wall and cell processes,489887,490705,480355,483231,FALSE,TRUE,GATGGAATCAGGAAG,GTTGCCTGGTGAAAT,ATG,-4.10793,8,TRUE,FALSE,-1.469835,10,,4,,GTGA,325,1
CDS,507758,508555,-,"Locus=Rv0422c;Name=thiD;Function=Involved in thiamine biosynthesis. Catalyzes the phosphorylation of HMP-P to HMP-pp [catalytic activity: ATP + 4-amino-2-methyl-5-phosphomethylpyrimidine = ADP + 4-amino-2-methyl-5-diphosphomethylpyrimidine].;Product=Probable phosphomethylpyrimidine kinase ThiD (HMP-phosphate kinase) (HMP-P kinase);Comments=Rv0422c, (MTCY22G10.19c), len: 265 aa. Probable thiD, phosphomethylpyrimidine kinase, equivalent to AL035159|MLCB1450_21 phosphomethylpyrimidine kinase from Mycobacterium leprae (279 aa), FASTA scores: opt: 1386, E(): 0, (77.8% identity in 266 aa overlap). Also highly similar to others e.g. HIU32725_3|P44697|THID_HAEIN phosphomethylpyrimidine kinase from Haemophilus influenzae (269 aa), FASTA scores: opt: 605, E(): 0, (42.1% identity in 259 aa overlap). Belongs to the ThiD family.;UniProt_AC=P9WG77;Is_Pseudogene=No;Functional_Category=intermediary metabolism and respiration;Protein Data Bank=;PFAM=P66913;UniProt=P9WG77;Gene Ontology=GO:0008902,GO:0008972,GO:0009228,GO:0005524;Enzyme Classification=2.7.4.7,2.7.1.49;Drug Resistance Mutations=;InterPro=;UniProtKB/TrEMBL=;SWISS-MODEL=P9WG77",thiD,Rv0422c,Probable phosphomethylpyrimidine kinase ThiD (HMP-phosphate kinase) (HMP-P kinase),intermediary metabolism and respiration,508582,510225,507132,507761,FALSE,TRUE,CCCGCTGGCACCGCC,CGCCGCTGTTTCGGC,ATG,0.827129999999999,12,FALSE,FALSE,0.827129999999999,6,,4,,ATGA,327,1
CDS,524530,525390,-,"Locus=Rv0436c;Name=pssA;Function=Involved in phospholipid biosynthesis. Generates phosphatidylserine [catalytic activity: CDP-diacylglycerol + L-serine = CMP + O-SN-phosphatidyl-L-serine].;Product=Probable CDP-diacylglycerol--serine O-phosphatidyltransferase PssA (PS synthase) (phosphatidylserine synthase);Comments=Rv0436c, (MTCY22G10.33c), len: 286 aa. Probable pssA, PS synthase (CDP-diacylglycerol--serine O-phosphatidyltransferase) (see citation below), integral membrane protein, equivalent to AL035159|MLCB1450_9|T44730 from Mycobacterium leprae (300 aa), FASTA scores: opt: 1506, E(): 0, (77.9% identity in 285 aa overlap). Also highly similar to others e.g. NP_108059.1|14027250|BAB54204.1|AP003012 phosphatidylserine synthase from Mesorhizobium loti (248 aa); PSS_BACSU|P39823 cdp-diacylglycerol--serine o-phosphatidyltransferase from Bacillus subtilis (177 aa), FASTA scores: opt: 277, E(): 9.9e-12, (33.3% identity in 183 aa overlap); etc. Contains PS00379 CDP-alcohol phosphatidyltransferases signature. Belongs to the CDP-alcohol phosphatidyltransferase class-I family.;UniProt_AC=P9WPG1;Is_Pseudogene=No;Functional_Category=lipid metabolism;Protein Data Bank=;PFAM=P96282;UniProt=P9WPG1;Gene Ontology=GO:0003882,GO:0016021,GO:0008654,GO:0005886,GO:0046341;Enzyme Classification=2.7.8.8;Drug Resistance Mutations=;InterPro=;UniProtKB/TrEMBL=;SWISS-MODEL=",pssA,Rv0436c,Probable CDP-diacylglycerol--serine O-phosphatidyltransferase PssA (PS synthase) (phosphatidylserine synthase),lipid metabolism,525387,526082,522347,524533,TRUE,TRUE,CCGTGCTGGCCGAAT,GCAAGCCGGGTCGAC,ATG,0.827129999999999,11,FALSE,FALSE,-3.00755,9,4,4,ATGA,GTGA,328,1
CDS,525387,526082,-,"Locus=Rv0437c;Name=psd;Function=Function unknown, but involved in lipid metabolism [catalytic activity: phosphatidyl-L-serine = phosphatidylethanolamine + CO(2)].;Product=Possible phosphatidylserine decarboxylase Psd (PS decarboxylase);Comments=Rv0437c, (MTV037.01c), len: 231 aa (start uncertain). Possible psd, phosphatidylserine decarboxylase , equivalent to CAC29819.1|AL583918 conserved hypothetical protein from Mycobacterium leprae (243 aa); and highly similar to MLCB1450.11|T44729|4154044|CAA22695.1|AL035159 hypothetical protein from Mycobacterium leprae (202 aa), FASTA score: (74.6% identity in 197 aa overlap). Also similar to other phosphatidylserine decarboxylases e.g. NP_108058.1|14027249|BAB54203.1|AP003012 phosphatidylserine decarboxylase from Mesorhizobium loti (232 aa); AAK86872|g15156090|AGR_C_1963 phosphatidylserine decarboxylase from Agrobacterium tumefaciens (244 aa); AAG12422.1|AY005137|Psd phosphatidylserine decarboxylase from Chlorobium tepidum (216 aa); etc.;UniProt_AC=P9WHQ5;Is_Pseudogene=No;Functional_Category=lipid metabolism;Protein Data Bank=;PFAM=P67547;UniProt=P9WHQ5;Gene Ontology=GO:0006646,GO:0004609,GO:0048037;Enzyme Classification=4.1.1.65;Drug Resistance Mutations=;InterPro=;UniProtKB/TrEMBL=;SWISS-MODEL=P9WHQ5",psd,Rv0437c,Possible phosphatidylserine decarboxylase Psd (PS decarboxylase),lipid metabolism,526143,527360,524530,525390,FALSE,TRUE,AGCTCCGTAAGATGA,CCGTGCTGGCCGAAT,GTG,0.9151,10,FALSE,FALSE,0.827129999999999,11,,4,,ATGA,329,1
CDS,536504,537169,-,"Locus=Rv0448c;Name=Rv0448c;Function=Function unknown;Product=Conserved hypothetical protein;Comments=Rv0448c, (MTV037.12c), len: 221 aa. Conserved hypothetical protein, similar to other hypothetical proteins e.g. Z74841|BOD5A2_1 from B. oleracea (283 aa), FASTA scores: opt: 257, E(): 1.4e-10, (32.0% identity in 197 aa overlap); etc. Some similarity to U15183|MLU15183_38 from Mycobacterium leprae (82 aa), FASTA scores: opt: 134, E(): 0.014, (71.0% identity in 31 aa overlap).;UniProt_AC=O53733;Is_Pseudogene=No;Functional_Category=conserved hypotheticals;Protein Data Bank=;PFAM=O53733;UniProt=O53733;Gene Ontology=;Enzyme Classification=;Drug Resistance Mutations=;InterPro=;UniProtKB/TrEMBL=;SWISS-MODEL=",Rv0448c,Rv0448c,Conserved hypothetical protein,conserved hypotheticals,537229,538548,535224,536507,FALSE,TRUE,CCACTGCAGACAAGT,GAGTTCCGGTGGTGC,GTG,0.9151,7,FALSE,FALSE,-1.469835,10,,4,,ATGA,331,1
CDS,541488,541910,-,"Locus=Rv0451c;Name=mmpS4;Function=Unknown;Product=Probable conserved membrane protein MmpS4;Comments=Rv0451c, (MTV037.15c), len: 140 aa. Probable mmpS4, conserved membrane protein (see citations below), equivalent to U1740W|P54880|YV33_MYCLE hypothetical 16.9 kDa protein from Mycobacterium leprae (154 aa), FASTA scores: opt: 727, E(): 0, (75.9% identity in 137 aa overlap). Also similar to other Mycobacterial proteins e.g. Z84725|MTCY04D9.16c from Mycobacterium tuberculosis (142 aa), FASTA scores: opt: 451, E(): 3.2e-24, (50.0% identity in 138 aa overlap); etc. Belongs to the MmpS family. A core mycobacterial gene; conserved in mycobacterial strains (See Marmiesse et al., 2004). Predicted to be an outer membrane protein (See Song et al., 2008).;UniProt_AC=P9WJS9;Is_Pseudogene=No;Functional_Category=cell wall and cell processes;Protein Data Bank=;PFAM=P0A5K2;UniProt=P9WJS9;Gene Ontology=GO:0016021;Enzyme Classification=;Drug Resistance Mutations=;InterPro=;UniProtKB/TrEMBL=;SWISS-MODEL=P9WJS9",mmpS4,Rv0451c,Probable conserved membrane protein MmpS4,cell wall and cell processes,545375,545821,538588,541491,FALSE,TRUE,GGGATCTGAGATTTT,ACTGCTTGGTGAAGT,GTG,-2.78552,16,FALSE,FALSE,-1.469835,10,,4,,GTGA,332,1
CDS,554882,556306,-,"Locus=Rv0465c;Name=Rv0465c;Function=Possibly involved in transcriptional mechanism.;Product=Probable transcriptional regulatory protein;Comments=Rv0465c, (MTV038.09c), len: 474 aa. Probable transcriptional regulator, highly similar to AC44331.1|AL596102 putative DNA-binding protein from Streptomyces coelicolor (489 aa); and similar to several hypothetical proteins and others transcriptional regulators. Some similarity in N-terminal region (1-100 aa) with repressors e.g. P06153|RPC_BPPH1 immunity repressor protein (144 aa), FASTA scores: opt: 130, E(): 0.084,(27.0% identity in 100 aa overlap). Very similar to Rv1129c|Z95585|MTCY22G8.18c from Mycobacterium tuberculosis (486 aa), FASTA scores: opt: 1475, E(): 0, (47.4% identity in 468 aa overlap). Contains probable helix-turn-helix motif at aa 19-40 (1827, +5.41 SD).;UniProt_AC=P9WMI1;Is_Pseudogene=No;Functional_Category=regulatory proteins;Protein Data Bank=;PFAM=O53750;UniProt=P9WMI1;Gene Ontology=GO:0043565,GO:0006350,GO:0045449;Enzyme Classification=;Drug Resistance Mutations=;InterPro=;UniProtKB/TrEMBL=;SWISS-MODEL=P9WMI1",Rv0465c,Rv0465c,Probable transcriptional regulatory protein,regulatory proteins,560848,561711,554313,554885,FALSE,TRUE,ACCCGGTACGCTCGG,CGTATCTGGTGAAAC,GTG,-1.569835,13,FALSE,FALSE,-1.469835,10,,4,,ATGA,334,1
CDS,568964,569806,-,"Locus=Rv0480c;Name=Rv0480c;Function=Function unknown; hydrolytic enzyme probably involved in cellular metabolism.;Product=Possible amidohydrolase;Comments=Rv0480c, (MTCY20G9.06c), len: 280 aa. Possible amidohydrolase, highly similar to NP_302587.1|NC_002677|CAC31966.1|AL583925 putative hydrolase from Mycobacterium leprae (271 aa). Also similar to other hydrolases and hypothetical proteins e.g. NP_601985.1|NC_003450 Predicted amidohydrolase from Corynebacterium glutamicum (266 aa); NP_459623.1|NC_003197 putative hydrolase from Salmonella typhimurium LT2 (262 aa); AL096822|SCGD3_8|NP_627996.1|NC_003888 probable hydrolase from Streptomyces coelicolor (264 aa), FASTA scores: opt: 368, E(): 6.1e-15, (34.2% identity in 272 aa overlap); YAUB_SCHPO|Q10166 hypothetical 35.7 kDa protein c26a3.11 from S. pombe (322 aa), FASTA scores: opt: 338, E():1.4e-13, (30.3% identity in 277 aa overlap); etc. Start changed since first submission (-60 aa).;UniProt_AC=P9WJ01;Is_Pseudogene=No;Functional_Category=intermediary metabolism and respiration;Protein Data Bank=;PFAM=Q11146;UniProt=P9WJ01;Gene Ontology=GO:0006807,GO:0016810;Enzyme Classification=3.5.-.-;Drug Resistance Mutations=;InterPro=;UniProtKB/TrEMBL=;SWISS-MODEL=P9WJ01",Rv0480c,Rv0480c,Possible amidohydrolase,intermediary metabolism and respiration,569988,570512,567921,568967,FALSE,TRUE,CGGGCCTAGGCTGGC,ATAAGGCACAATCGC,ATG,-4.89374,10,TRUE,FALSE,-2.332995,15,,4,,GTGA,336,1
CDS,583375,583704,-,"Locus=Rv0492A;Name=Rv0492A;Function=Unknown;Product=Hypothetical protein;Comments=Rv0492A, len: 109 aa. Hypothetical unknown protein. GC plot suggests CDS.;UniProt_AC=Q6MX36;Is_Pseudogene=No;Functional_Category=conserved hypotheticals;Protein Data Bank=;PFAM=;UniProt=Q6MX36;Gene Ontology=;Enzyme Classification=;Drug Resistance Mutations=;InterPro=;UniProtKB/TrEMBL=;SWISS-MODEL=",Rv0492A,Rv0492A,Hypothetical protein,conserved hypotheticals,583701,584690,581489,583378,TRUE,TRUE,TCAAGGAAGGGACGC,GCCGGCTCGGGCGCC,ATG,-6.91615,10,TRUE,FALSE,-1.29604,9,4,4,ATGA,ATGA,336,1
CDS,583701,584690,-,"Locus=Rv0493c;Name=Rv0493c;Function=Function unknown;Product=Conserved protein;Comments=Rv0493c, (MTCY20G9.19), len: 329 aa. Conserved protein, showing some similarity to U00018_33|B2168_F2_93 from Mycobacterium leprae (167 aa), FASTA scores: opt: 166, E(): 0.00077, (35.9% identity in 131 aa overlap).;UniProt_AC=P9WKU7;Is_Pseudogene=No;Functional_Category=conserved hypotheticals;Protein Data Bank=;PFAM=;UniProt=P9WKU7;Gene Ontology=;Enzyme Classification=;Drug Resistance Mutations=;InterPro=;UniProtKB/TrEMBL=;SWISS-MODEL=",Rv0493c,Rv0493c,Conserved protein,conserved hypotheticals,585424,586314,583375,583704,FALSE,TRUE,CATTGGCTCAACCAA,TCAAGGAAGGGACGC,GTG,0.827129999999999,14,FALSE,TRUE,-6.91615,10,,4,,ATGA,337,1
CDS,636210,637463,-,"Locus=Rv0545c;Name=pitA;Function=Involved in low-affinity inorganic phosphate transport across the membrane. Responsible for the translocation of the substrate across the membrane.;Product=Probable low-affinity inorganic phosphate transporter integral membrane protein PitA;Comments=Rv0545c, (MTCY25D10.24c), len: 417 aa. Probable pitA, low-affinity inorganic phosphate transporter, integral membrane protein, equivalent to Q50173|NP_302471.1 pitA from Mycobacterium leprae (414 aa), FASTA scores: opt: 2035, E(): 0, (76.3% identity in 418 aa overlap). Also highly similar to others e.g. CAB59461.1|AL132644 putative low-affinity phosphate transport protein from Streptomyces coelicolor (423 aa); PITA_ECOLI|P37308 low-affinity inorganic phosphate transporter from Escherichia coli (499 aa), FASTA scores: opt: 304, E(): 6.9e-10, (32.5 % identity in 234 aa overlap); etc. Belongs to the PHO-4 family of transporters, pit subfamily.;UniProt_AC=P9WIA7;Is_Pseudogene=No;Functional_Category=cell wall and cell processes;Protein Data Bank=;PFAM=O06411;UniProt=P9WIA7;Gene Ontology=GO:0016021,GO:0006817,GO:0005886,GO:0005315;Enzyme Classification=;Drug Resistance Mutations=;InterPro=;UniProtKB/TrEMBL=;SWISS-MODEL=P9WIA7",pitA,Rv0545c,Probable low-affinity inorganic phosphate transporter integral membrane protein PitA,cell wall and cell processes,637583,637969,635935,636213,FALSE,TRUE,ACCAGCAGAATCAGG,TCACCACGAGGAACG,GTG,-3.232995,6,FALSE,TRUE,-4.468055,6,,4,,GTGA,338,1
CDS,640638,640904,-,"Locus=Rv0550c;Name=vapB3;Function=Unknown;Product=Possible antitoxin VapB3;Comments=Rv0550c, (MTCY25D10.29c), len: 88 aa. Possible vapB3, antitoxin, part of toxin-antitoxin (TA) operon with Rv0549c (See Arcus et al., 2005; Pandey and Gerdes, 2005).;UniProt_AC=P9WJ59;Is_Pseudogene=No;Functional_Category=virulence, detoxification, adaptation;Protein Data Bank=;PFAM=O06416;UniProt=P9WJ59;Gene Ontology=;Enzyme Classification=;Drug Resistance Mutations=;InterPro=;UniProtKB/TrEMBL=;SWISS-MODEL=",vapB3,Rv0550c,Possible antitoxin VapB3,"virulence, detoxification, adaptation",641096,642811,640228,640641,FALSE,TRUE,AAAGAACCCGCCGAA,CTCGCGATGAGTTCG,TTG,0.9151,17,FALSE,FALSE,-1.80793,5,,4,,GTGA,339,1
CDS,695228,695485,-,"Locus=Rv0596c;Name=vapB4;Function=Unknown;Product=Possible antitoxin VapB4;Comments=Rv0596c, (MTCY19H5.26), len: 85 aa. Possible vapB4, antitoxin, part of toxin-antitoxin (TA) operon with Rv0595c (See Arcus et al., 2005; Pandey and Gerdes, 2005). Highly similar in part to other M. tuberculosis hypothetical proteins e.g. Rv0626, Rv3181c, Rv3385c, Rv3407, etc. This region is a possible MT-complex-specific genomic island (See Becq et al., 2007).;UniProt_AC=P9WF21;Is_Pseudogene=No;Functional_Category=virulence, detoxification, adaptation;Protein Data Bank=;PFAM=O07782;UniProt=P9WF21;Gene Ontology=;Enzyme Classification=;Drug Resistance Mutations=;InterPro=;UniProtKB/TrEMBL=;SWISS-MODEL=P9WF21",vapB4,Rv0596c,Possible antitoxin VapB4,"virulence, detoxification, adaptation",695668,696903,694839,695231,FALSE,TRUE,GCTCCGCTACACTCG,CCACGGACGATGTGC,ATG,2.375225,5,FALSE,FALSE,-1.247805,13,,4,,GTGA,340,1
CDS,697564,697800,-,"Locus=Rv0599c;Name=vapB27;Function=Unknown;Product=Possible antitoxin VapB27;Comments=Rv0599c, (MTCY19H5.23), len: 78 aa. Possible vapB27, antitoxin, part of toxin-antitoxin (TA) operon with Rv0598c, see Arcus et al. 2005. Similar to others e.g. Rv2595|Y0B6_MYCTU|Q50626 conserved hypothetical protein from Mycobacterium tuberculosis (81 aa), FASTA scores: opt: 160, E(): 6.2e-07, (35.8% identity in 81 aa overlap). N-terminus shows stong similarity with N-terminus of NP_104908.1|NC_002678 hypothetical protein from Mesorhizobium loti (89 aa). This region is a possible MT-complex-specific genomic island (See Becq et al., 2007).;UniProt_AC=O07779;Is_Pseudogene=No;Functional_Category=virulence, detoxification, adaptation;Protein Data Bank=;PFAM=O07779;UniProt=O07779;Gene Ontology=;Enzyme Classification=;Drug Resistance Mutations=;InterPro=;UniProtKB/TrEMBL=;SWISS-MODEL=O07779",vapB27,Rv0599c,Possible antitoxin VapB27,"virulence, detoxification, adaptation",697904,698410,697154,697567,FALSE,TRUE,CCATTGGTATCGTAT,TTATCGATAGCGGCC,ATG,-1.569835,12,FALSE,FALSE,0.827129999999999,7,,4,,GTGA,341,1
CDS,721729,725013,-,"Locus=Rv0630c;Name=recB;Function=Involved in homologous recombination.;Product=Probable exonuclease V (beta chain) RecB (exodeoxyribonuclease V beta chain)(exodeoxyribonuclease V polypeptide) (chi-specific endonuclease);Comments=Rv0630c, (MTCY20H10.11c), len: 1094 aa. Probable recB, exonuclease V, beta chain (exodeoxyribonuclease V, beta chain) (see citation below), highly similar to other exonucleases e.g. AF157643_2|recB|AAD46808.1 Escherichia coli RecB protein homolog from Mycobacterium smegmatis (1083 aa); P08394|EX5B_ECOLI|RORA|B2820 exodeoxyribonuclease V 135 kDa polypeptide (exonuclease V beta chain) from Escherichia coli strain K12 (1180 aa), FASTA scores: opt: 289, E(): 4.3e-11, (29.5 identity in 1059 aa overlap); etc. Contains PS00017 ATP/GTP-binding site motif A (P-loop). Belongs to the helicase family, UVRD subfamily. Consists of three subunits; RECB, RECC|Rv0631c and recd|Rv0629c.;UniProt_AC=P9WMQ3;Is_Pseudogene=No;Functional_Category=information pathways;Protein Data Bank=;PFAM=P96920;UniProt=P9WMQ3;Gene Ontology=GO:0004003,GO:0003677,GO:0006281,GO:0004519,GO:0008854,GO:0005524;Enzyme Classification=3.1.11.5;Drug Resistance Mutations=;InterPro=;UniProtKB/TrEMBL=;SWISS-MODEL=P9WMQ3",recB,Rv0630c,Probable exonuclease V (beta chain) RecB (exodeoxyribonuclease V beta chain)(exodeoxyribonuclease V polypeptide) (chi-specific endonuclease),information pathways,725013,728306,720005,721732,TRUE,TRUE,CCGCCGAAGGGTCGG,ACCGGGGAAGGCTGC,ATG,-7.841975,6,TRUE,TRUE,-5.29374,9,1,4,A,GTGA,341,1
