type,start,end,strand,attributes,locus_name,Rv_name,product_name,function_group,prev_start,prev_end,next_start,next_end,overlap_prev,overlap_next,seq_upstream,seq_next_upstream,start_codon,deltaG,RBS_dist,has_RBS,next_has_RBS,next_deltaG,next_RBS_dist,n_overlap_prev,n_overlap_next,seq_overlap_prev,seq_overlap_next,group,frame
CDS,2819124,2819870,-,"Locus=Rv2504c;Name=scoA;Function=Involved in fatty acid degradation/synthesis [catalytic activity: succinyl-CoA + a 3-oxo acid = succinate + a 3-oxo-acyl-CoA].;Product=Probable succinyl-CoA:3-ketoacid-coenzyme A transferase (alpha subunit) ScoA (3-oxo acid:CoA transferase) (OXCT A) (succinyl-CoA:3-oxoacid-coenzyme A transferase);Comments=Rv2504c, (MT2579, MTCY07A7.10c), len: 248 aa. Probable scoA, succinyl-CoA:3-ketoacid-Coenzyme A transferase, alpha subunit (3-oxo acid:CoA transferase). Highly similar to others e.g. Q9XAM7|SC4C6.13c from Streptomyces coelicolor (260 aa), FASTA scores: opt: 1130, E(): 2.2e-64, (69.9% identity in 249 aa overlap); Q9XD83|PCAI from Streptomyces sp. 2065 (251 aa), FASTA scores: opt: 1121, E(): 8.1e-64, (69.5% identity in 249 aa overlap); etc. Belongs to the 3-oxoacid CoA-transferase subunit A family.;UniProt_AC=P9WPW5;Is_Pseudogene=No;Functional_Category=lipid metabolism;Protein Data Bank=;PFAM=P63648;UniProt=P9WPW5;Gene Ontology=GO:0008152,GO:0008260;Enzyme Classification=2.8.3.5;Drug Resistance Mutations=;InterPro=;UniProtKB/TrEMBL=;SWISS-MODEL=P9WPW5",scoA,Rv2504c,Probable succinyl-CoA:3-ketoacid-coenzyme A transferase (alpha subunit) ScoA (3-oxo acid:CoA transferase) (OXCT A) (succinyl-CoA:3-oxoacid-coenzyme A transferase),lipid metabolism,2819953,2821596,2818471,2819127,FALSE,TRUE,TGCTAGGAGGCTCTG,AGAGGGAGACGGTGC,ATG,-9.81615,11,TRUE,TRUE,-7.33894,8,,4,,ATGA,469,1
CDS,2833510,2833761,-,"Locus=Rv2517c;Name=Rv2517c;Function=Unknown;Product=Unknown protein;Comments=Rv2517c, (MTV009.02c), len: 83 aa. Unknown protein. Equivalent to AAK46899 from Mycobacterium tuberculosis strain CDC1551 (97 aa) but shorter 14 aa.;UniProt_AC=O53222;Is_Pseudogene=No;Functional_Category=conserved hypotheticals;Protein Data Bank=;PFAM=;UniProt=O53222;Gene Ontology=;Enzyme Classification=;Drug Resistance Mutations=;InterPro=;UniProtKB/TrEMBL=;SWISS-MODEL=",Rv2517c,Rv2517c,Unknown protein,conserved hypotheticals,2834109,2835335,2832710,2833513,FALSE,TRUE,CAAGTGTTGGGGAGA,ACAGGAAGGAAGGCG,GTG,-5.145645,6,TRUE,TRUE,-6.11615,8,,4,,GTGA,470,1
CDS,2839538,2839930,-,"Locus=Rv2523c;Name=acpS;Function=Biosynthesis of fatty acids and lipids. Transfers the 4'-phosphopantetheine moiety from coenzyme A to a SER of acyl-carrier protein. Catalyzes the formation of holo-ACP, which mediates the transfer of acyl fatty-acid intermediates during the biosynthesis of fatty acids and lipids [catalytic activity: CoA + APO-[acyl-carrier protein] = adenosine 3',5'-bisphosphate + holo-[acyl-carrier protein] ].;Product=holo-[acyl-carrier protein] synthase AcpS (holo-ACP synthase) (CoA:APO-[ACP]pantetheinephosphotransferase) (CoA:APO-[acyl-carrier protein]pantetheinephosphotransferase);Comments=Rv2523c, (MT2599, MTV009.08c), len: 130 aa. AcpS, holo-[Acyl Carrier Protein] synthase (see citation below), equivalent to Q9X7E3|ACPS_MYCLE|ML1192|MLCB458.07 holo-[acyl-carrier protein] synthase from Mycobacterium leprae (130 aa), FASTA scores: opt: 732, E(): 5.5e-42, (87.5% identity in 128 aa overlap). Also similar to others e.g. O86785|ACPS_STRCO|SC6G4.22c from Streptomyces coelicolor (123 aa), FASTA scores: opt: 204, E(): 6.6e-07, (36.7% identity in 139 aa overlap); Q9KPB6|VC2457 from Vibrio cholerae (126 aa), FASTA scores: opt: 163, E(): 0.00036, (32.55% identity in 129 aa overlap); P24224|ACPS_ECOLI|DPJ|B2563 from Escherichia coli strain K12 (125 aa), FASTA scores: opt: 151, E(): 0.0022, (30.55% identity in 131 aa overlap); etc. Belongs to the ACPS family. Acts on fas-I enzymes in C. glutamicum (See Chalut et al., 2006).;UniProt_AC=P9WQD3;Is_Pseudogene=No;Functional_Category=lipid metabolism;Protein Data Bank=3H7Q,3HQJ,3NE1,3NE3;PFAM=P0A4W8;UniProt=P9WQD3;Gene Ontology=GO:0006633,GO:0008897,GO:0009059,GO:0000287,GO:0005737;Enzyme Classification=2.7.8.7;Drug Resistance Mutations=;InterPro=;UniProtKB/TrEMBL=;SWISS-MODEL=P9WQD3",acpS,Rv2523c,holo-[acyl-carrier protein] synthase AcpS (holo-ACP synthase) (CoA:APO-[ACP]pantetheinephosphotransferase) (CoA:APO-[acyl-carrier protein]pantetheinephosphotransferase),lipid metabolism,2840123,2849332,2838129,2839541,FALSE,TRUE,TCGATTAACGTGGCC,TCGCCATCCTGGAGG,ATG,0.827129999999999,7,FALSE,TRUE,-8.556025,5,,4,,GTGA,471,1
CDS,2854683,2854907,-,"Locus=Rv2530A;Name=vapB39;Function=Unknown;Product=Possible antitoxin VapB39;Comments=Rv2530A, len: 74 aa. Possible vapB39, antitoxin, part of toxin-antitoxin (TA) operon with Rv2530c, see Arcus et al. 2005. Similar to others in Mycobacterium tuberculosis e.g. O53218|Rv2493 (73 aa), FASTA scores: opt: 240, E(): 5.7e-11, (56.75% identity in 74 aa overlap); and Q92WE1|RB0399|SMB20413 hypothetical protein from Rhizobium meliloti (Sinorhizobium meliloti)p lasmid pSymB (megaplasmid 2) (75 aa), FASTA scores: opt: 226, E(): 6.5e-10, (56.00% identity in 75 aa overlap).;UniProt_AC=P9WJ23;Is_Pseudogene=No;Functional_Category=virulence, detoxification, adaptation;Protein Data Bank=;PFAM=;UniProt=P9WJ23;Gene Ontology=;Enzyme Classification=;Drug Resistance Mutations=;InterPro=;UniProtKB/TrEMBL=;SWISS-MODEL=",vapB39,Rv2530A,Possible antitoxin VapB39,"virulence, detoxification, adaptation",2854938,2857781,2854267,2854686,FALSE,TRUE,AGCCCCGTAACATGA,GCGCGCTCGAGGACG,ATG,1.5151,18,FALSE,TRUE,-4.40793,8,,4,,GTGA,472,1
CDS,2861588,2862676,-,"Locus=Rv2538c;Name=aroB;Function=Involved at the second step in the biosynthesis of chorismate within the biosynthesis of aromatic amino acids (the shikimate pathway) [catalytic activity: 7-phospho-3-deoxy-arabino-heptulosonate = 3-dehydroquinate + orthophosphate].;Product=3-dehydroquinate synthase AroB;Comments=Rv2538c, (MTCY159.18), len: 362 aa. AroB, 3-dehydroquinate synthase (see citations below), equivalent to Q9CCS4|AROB_MYCLE|ML0518 3-dehydroquinate synthase from Mycobacterium leprae (361 aa), FASTA scores: opt: 2059, E(): 3.3e-117, (87.25% identity in 361 aa overlap). Also highly similar to many e.g. Q9KXQ6|AROB from Streptomyces coelicolor (363 aa), FASTA scores: opt: 1363, E(): 4e-75, (60.05% identity in 358 aa overlap); Q9X5D2|AROB_CORGL from Corynebacterium glutamicum (Brevibacterium flavum) (366 aa), FASTA scores: opt: 1154, E(): 1.7e-62, (50.95% identity in 359 aa overlap); P07639|AROB_ECOLI|B3389 from Escherichia coli strain K12 (362 aa), FASTA scores: opt: 771, E(): 2.4e-39, (40.6% identity in 345 aa overlap); etc. Belongs to the dehydroquinate synthase family.;UniProt_AC=P9WPX9;Is_Pseudogene=No;Functional_Category=intermediary metabolism and respiration;Protein Data Bank=;PFAM=P0A4Z4;UniProt=P9WPX9;Gene Ontology=GO:0009073,GO:0005737,GO:0003856;Enzyme Classification=4.2.3.4;Drug Resistance Mutations=;InterPro=;UniProtKB/TrEMBL=;SWISS-MODEL=P9WPX9",aroB,Rv2538c,3-dehydroquinate synthase AroB,intermediary metabolism and respiration,2862673,2863203,2861148,2861591,TRUE,TRUE,GCCCCAGCGAGGCGG,ACGCCGGAGTTTGCG,ATG,-3.60793,8,TRUE,TRUE,-3.756025,5,4,4,ATGA,ATGA,473,1
CDS,2862673,2863203,-,"Locus=Rv2539c;Name=aroK;Function=Involved at the fifth step in the biosynthesis of chorismate within the biosynthesis of aromatic amino acids (the shikimate pathway) [catalytic activity: ATP + shikimate = ADP + shikimate 3-phosphate].;Product=Shikimate kinase AroK (SK);Comments=Rv2539c, (MTCY159.17), len: 176 aa. AroK, shikimate kinase (see citations below), equivalent to Q9CCS5|AROK|ML0517 putative shikimate kinase from Mycobacterium leprae (199 aa), FASTA scores: opt: 852, E(): 1.3e-42, (79.65% identity in 167 aa overlap). Also highly similar to many e.g. Q9X5D1|AROK_CORG from Corynebacterium glutamicum (Brevibacterium flavum) (169 aa), FASTA scores: opt: 478, E(): 5.4e-21, (47.0% identity in 168 aa overlap); Q9KXQ5|AROK from Streptomyces coelicolor (171 aa), FASTA scores: opt: 465, E(): 3.1e-20, (49.1% identity in 167 aa overlap); P24167|AROK_ECOLI from Escherichia coli strain K12 (172 aa), FASTA scores: opt: 316, E(): 1.3e-11, (38.4% identity in 164 aa overlap); etc. Contains PS00017 ATP/GTP-binding site motif A, and PS01128 Shikimate kinase signature. Belongs to the shikimate kinase family.;UniProt_AC=P9WPY3;Is_Pseudogene=No;Functional_Category=intermediary metabolism and respiration;Protein Data Bank=1L4U,1L4Y,1U8A,1WE2,1ZYU,2DFN,2DFT,2G1J,2G1K,2IYQ,2IYR,2IYS,2IYT,2IYU,2IYV,2IYW,2IYX,2IYY,2IYZ,3BAF;PFAM=P0A4Z2;UniProt=P9WPY3;Gene Ontology=GO:0009073,GO:0005737,GO:0000287,GO:0004765,GO:0005524;Enzyme Classification=2.7.1.71;Drug Resistance Mutations=;InterPro=;UniProtKB/TrEMBL=;SWISS-MODEL=P9WPY3",aroK,Rv2539c,Shikimate kinase AroK (SK),intermediary metabolism and respiration,2863207,2864412,2861588,2862676,FALSE,TRUE,GCGGGTCTCCGGTTA,GCCCCAGCGAGGCGG,ATG,-3.578815,7,TRUE,TRUE,-3.60793,8,,4,,ATGA,474,1
CDS,2870119,2870364,-,"Locus=Rv2550c;Name=vapB20;Function=Unknown;Product=Possible antitoxin VapB20;Comments=Rv2550c, (MTCY159.06), len: 81 aa. Possible vapB20, antitoxin, part of toxin-antitoxin (TA) operon with Rv2549c (See Arcus et al., 2005; Pandey and Gerdes, 2005). Some similarity to others in M. tuberculosis e.g. Rv0581;UniProt_AC=P9WJ45;Is_Pseudogene=No;Functional_Category=virulence, detoxification, adaptation;Protein Data Bank=;PFAM=P95003;UniProt=P9WJ45;Gene Ontology=GO:0006355,GO:0003677;Enzyme Classification=;Drug Resistance Mutations=;InterPro=;UniProtKB/TrEMBL=;SWISS-MODEL=",vapB20,Rv2550c,Possible antitoxin VapB20,"virulence, detoxification, adaptation",2870775,2871194,2869727,2870122,FALSE,TRUE,TACCGATGTATACAG,TGGTTTACGGAAAGC,ATG,0.4151,6,FALSE,FALSE,-1.469835,16,,4,,ATGA,475,1
CDS,2872012,2873265,-,"Locus=Rv2553c;Name=Rv2553c;Function=Unknown;Product=Probable conserved membrane protein;Comments=Rv2553c, (MTCY159.03), len: 417 aa. Probable conserved membrane protein, equivalent to Q9CCS8|ML0514 putative membrane protein from Mycobacterium leprae (421 aa), FASTA scores: opt: 1955, E(): 1.1e-111, (72.7% identity in 414 aa overlap). Also similar in part to various proteins e.g. Q9L9G6|NOVB NOVB protein (aminodesoxychorismate lyase) from Streptomyces sphaeroides (284 aa), FASTA scores: opt: 451, E(): 2.9e-2, (37.95% identity in 203 aa overlap); Q9EWY3|2SCG38.36 conserved hypothetical protein from Streptomyces coelicolor (253 aa), FASTA scores: opt: 419, E(): 2.3e-18, (39.2% identity in 171 aa overlap); Q9CHT3|YGCC hypothetical protein from Lactococcus lactis (subsp. lactis) (Streptococcus lactis) (550 aa), FASTA scores: opt: 379, E(): 1.2e-15, (23.0% identity in 417 aa overlap); O25309|HP0587 aminodeoxychorismate lyase (PABC) from Helicobacter pylori (Campylobacter pylori) (329 aa), FASTA scores: opt: 290, E(): 2e-10, (31.65% identity in 180 aa overlap); etc.;UniProt_AC=I6XEK6;Is_Pseudogene=No;Functional_Category=cell wall and cell processes;Protein Data Bank=;PFAM=P95000;UniProt=I6XEK6;Gene Ontology=;Enzyme Classification=;Drug Resistance Mutations=;InterPro=;UniProtKB/TrEMBL=;SWISS-MODEL=I6XEK6",Rv2553c,Rv2553c,Probable conserved membrane protein,cell wall and cell processes,2873258,2873770,2871206,2872015,TRUE,TRUE,GGGACTCAAGAAGGC,GTGTCCTCGACAGCG,ATG,-3.09374,6,FALSE,FALSE,1.2151,8,8,4,ATGCCTGA,ATGA,475,1
CDS,2906089,2906763,-,"Locus=Rv2581c;Name=Rv2581c;Function=Involved in glyoxal pathway. Thiolesterase that catalyzes the hydrolysis of S-D-lactoyl-glutathione to form glutathione and D-lactic acid [catalytic activity: (S)-(2-hydroxyacyl)glutathione + H(2)O = glutathione + a 2-hydroxy acid anion].;Product=Possible glyoxalase II (hydroxyacylglutathione hydrolase) (GLX II);Comments=Rv2581c, (MTCY227.20), len: 224 aa. Possible glyoxalase II, equivalent to Q49649|YP81_MYCLE|ML0493|MLCB1259.11|B1177_C3_247 hypothetical 23.9 KDA protein from Mycobacterium leprae (218 aa), FASTA scores: opt: 1264, E(): 7.8e-73, (82.0% identity in 222 aa overlap). Also highly similar to Q9KXP1|SC9C5.33c possible hydrolase from Streptomyces coelicolor (235 aa), FASTA scores: opt: 654, E(): 2.9e-34, (46.8% identity in 220 aa overlap); and similar to Q9CI24|YFCI hypothetical protein from Lactococcus lactis (subsp. lactis) (Streptococcus lactis) (210 aa), FASTA scores: opt: 360, E(): 9.9e-16, (35.0% identity in 217 aa overlap); AAK75726|SP1646 metallo-beta-lactamase superfamily protein from Streptococcus pneumoniae (209 aa), FASTA scores: opt: 320, E(): 3.3e-13, (35.85% identity in 198 aa overlap); AAK80229|CAC2272 predicted Zn-dependent hydrolase of metallo-beta-lactamase superfamily from Clostridium acetobutylicum (199 aa), FASTA scores: opt: 282, E(): 8e-11, (32.7% identity in 217 aa overlap); etc. Equivalent to AAK46971 from Mycobacterium tuberculosis strain CDC1551 (246 aa) but shorter 22 aa. Belongs to the glyoxalase II family. Cofactor: binds two zinc ions.;UniProt_AC=P9WMW3;Is_Pseudogene=No;Functional_Category=virulence, detoxification, adaptation;Protein Data Bank=;PFAM=;UniProt=P9WMW3;Gene Ontology=GO:0046872,GO:0016787;Enzyme Classification=3.-.-.-;Drug Resistance Mutations=;InterPro=;UniProtKB/TrEMBL=;SWISS-MODEL=P9WMW3",Rv2581c,Rv2581c,Possible glyoxalase II (hydroxyacylglutathione hydrolase) (GLX II),"virulence, detoxification, adaptation",2907826,2910198,2904821,2906092,FALSE,TRUE,GGATGGGAAACTGGG,TCCTTGAGGGCTTGA,GTG,-5.29374,5,TRUE,TRUE,-4.456165,11,,4,,GTGA,478,1
CDS,2924230,2924820,-,"Locus=Rv2593c;Name=ruvA;Function=forms a complex with RUVB. RUVA stimulates, in the presence of DNA, the weak ATPase activity of RUVB. The RUVA-RUVB complex in the presence of ATP renatures cruciform structure in supercoiled DNA with palindromic sequence, indicating that it may promote strand exchange reactions in homologous recombination. RUVAB is an helicase that mediates the holliday junction migration by localized denaturation and reanneling.;Product=Probable holliday junction DNA helicase RuvA;Comments=Rv2593c, (MTCY227.08), len: 196 aa. Probable ruvA, Holliday junction binding protein (see citations below), equivalent to P40832|RUVA_MYCLE|ML0482|B1177_C2_188 holliday junction DNA helicase from Mycobacterium leprae (203 aa), FASTA scores: opt: 923, E(): 9.9e-50, (76.85% identity in 203 aa overlap). Also highly similar to others e.g. Q9L290|RUVA from Streptomyces coelicolor (201 aa) (201 aa), FASTA scores: opt: 549, E(): 8.2e-27, (47.55% identity in 204 aa overlap); Q9AE10|RUVA from Corynebacterium glutamicum (Brevibacterium flavum) (206 aa), FASTA scores: opt: 440, E(): 4e-20, (47.1% identity in 206 aa overlap); P08576|RUVA_ECOLI|B1861|Z2913|ECS2571 from Escherichia coli strains K12 and O157:H7 (203 aa), FASTA scores: opt: 312, E(): 2.8e-12, (34.85% identity in 201 aa overlap); etc. Belongs to the RuvA family.;UniProt_AC=P9WGW3;Is_Pseudogene=No;Functional_Category=information pathways;Protein Data Bank=2H5X,2ZTC,2ZTD,2ZTE;PFAM=P66744;UniProt=P9WGW3;Gene Ontology=GO:0003677,GO:0006310,GO:0006281,GO:0009379,GO:0009432,GO:0009378,GO:0005524;Enzyme Classification=3.6.4.12;Drug Resistance Mutations=;InterPro=;UniProtKB/TrEMBL=;SWISS-MODEL=P9WGW3",ruvA,Rv2593c,Probable holliday junction DNA helicase RuvA,information pathways,2924817,2925383,2923199,2924233,TRUE,TRUE,CCAAGCTGAAGGCCG,CGTTGCTGGGGAAGG,ATG,-2.332995,9,FALSE,TRUE,-6.99374,5,4,4,ATGA,ATGA,478,1
CDS,2924817,2925383,-,"Locus=Rv2594c;Name=ruvC;Function=Nuclease that resolves holliday junction intermediates in genetic recombination. Cleaves the cruciform structure in supercoiled DNA by nicking to strands with the same polarity at sites symmetrically opposed at the junction in the homologous ARMS and leaves a 5'terminal phosphate and a 3'terminal hydroxyl group [catalytic activity: endonucleolytic cleavage at a junction such as a reciprocal single-stranded crossover between two homologous DNA duplexes (holliday junction)].;Product=Probable crossover junction endodeoxyribonuclease RuvC (holliday junction nuclease) (holliday junction resolvase);Comments=Rv2594c, (MTCY227.07), len: 188 aa. Probable ruvC, Holliday junction resolvase (see citations below), equivalent to P40834|RUVC_MYCLE|ML0481|B1177_C3_226 crossover junction endodeoxyribonuclease from Mycobacterium leprae (188 aa), FASTA scores: opt: 984, E(): 2.3e-55, (81.0% identity in 184 aa overlap). Also highly similar to others e.g. Q9AE11|RUVC from Corynebacterium glutamicum (Brevibacterium flavum) (221 aa), FASTA scores: opt: 713, E(): 3.6e-38, (56.9% identity in 188 aa overlap); Q9L289|RUVC_STRCO|SCL2.10c from Streptomyces coelicolor (188 aa), FASTA scores: opt: 704, E(): 1.2e-37, (60.65% identity in 178 aa overlap); P24239|RUVC_ECOLI|B1863 from Escherichia coli strain K12 (172 aa), FASTA scores: opt: 322, E(): 1.6e-13, (38.65% identity in 163 aa overlap); etc. Belongs to the RUVC family. Cofactor: magnesium.;UniProt_AC=P9WGV9;Is_Pseudogene=No;Functional_Category=information pathways;Protein Data Bank=;PFAM=P66760;UniProt=P9WGV9;Gene Ontology=GO:0006281,GO:0008821,GO:0000287,GO:0003676,GO:0006310;Enzyme Classification=3.1.22.4;Drug Resistance Mutations=;InterPro=;UniProtKB/TrEMBL=;SWISS-MODEL=P9WGV9",ruvC,Rv2594c,Probable crossover junction endodeoxyribonuclease RuvC (holliday junction nuclease) (holliday junction resolvase),information pathways,2930805,2931560,2924230,2924820,FALSE,TRUE,ATGGCTGAGGGAGCG,CCAAGCTGAAGGCCG,GTG,-6.19374,5,TRUE,FALSE,-2.332995,9,,4,,ATGA,479,1
CDS,2939959,2940612,-,"Locus=Rv2612c;Name=pgsA1;Function=Catalyzes the transfer of a free alcohol (inositol) onto CDP-diacylglycerol. The product of this putative ORF seems be essential to mycobacteria [catalytic activity: CDP-diacylglycerol + myo-inositol = CMP + phosphatidyl 1D-myo-inositol]. PgsA1 utilises inositol-phosphate rather than inositol, in contrast to its Eukaryotic ortholog (see Gr&",pgsA1,Rv2612c,"","",2940609,2941196,2939012,2939962,TRUE,TRUE,CCGAGTGGGCTCGGC,TTCCTGGAAAGGGCG,ATG,-2.58185,6,FALSE,TRUE,-4.456165,8,4,4,ATGA,GTGA,480,1
CDS,2940609,2941196,-,"Locus=Rv2613c;Name=Rv2613c;Function=Function unknown; but could be involved in lipid metabolism.;Product=Conserved protein;Comments=Rv2613c, (MTCY01A10.20A), len: 195 aa. Conserved protein, equivalent to Q9CCU0|ML0455 hypothetical protein from Mycobacterium leprae (206 aa), FASTA scores: opt: 1074, E(): 7.4e-62, (84.7% identity in 196 aa overlap); and highly similar, but longer 18 aa, to O07150|MLCL581.17c hypothetical 20.7 KDA protein from Mycobacterium leprae (186 aa), FASTA scores: opt: 1038, E(): 1.4e-59, (89.7% identity in 175 aa overlap). Also highly similar to other hypothetical proteins (often Hit family member) e.g. Q9F7Z0 from Mycobacterium smegmatis (see citation below) (205 aa), FASTA scores: opt: 975, E(): 1.6e-55, (79.35% identity in 184 aa overlap); Q9L279|SCL2.20 from Streptomyces coelicolor (186 aa), FASTA scores: opt: 638, E(): 5.8e-34, (52.85% identity in 176 aa overlap); Q9YFX8|APE0122 from Aeropyrum pernix (184 aa), FASTA scores: opt: 515, E(): 4.4e-26, (45.9% identity in 159 aa overlap); etc. It seems the Rv2613c and downstream ORF Rv2612c|psgA1 are expressed from the same promoter (see citation below) and that Rv2613c should be involved in lipid metabolism.;UniProt_AC=P9WMK9;Is_Pseudogene=No;Functional_Category=lipid metabolism;Protein Data Bank=3ANO;PFAM=O06201;UniProt=P9WMK9;Gene Ontology=GO:0005524,GO:0003877;Enzyme Classification=2.7.7.53;Drug Resistance Mutations=;InterPro=;UniProtKB/TrEMBL=;SWISS-MODEL=P9WMK9",Rv2613c,Rv2613c,Conserved protein,lipid metabolism,2941189,2943267,2939959,2940612,TRUE,TRUE,CTGGTGAAAGTGGCC,CCGAGTGGGCTCGGC,GTG,-1.469835,15,FALSE,FALSE,-2.58185,6,8,4,GTGAGTGA,ATGA,480,1
CDS,2947884,2948558,-,"Locus=Rv2621c;Name=Rv2621c;Function=Could be involved in transcriptional mechanism.;Product=Possible transcriptional regulatory protein;Comments=Rv2621c, (MTCY01A10.11), len: 224 aa. Possible transcriptional regulator, similar in part to Q49688|MLCL536.29c|ML0592 putative DNA-binding protein from Mycobacterium leprae (254 aa), FASTA scores: opt: 168, E(): 0.0018, (29.75% identity in 222 aa overlap). Shows similarity with Q9XAD0|SCC22.08c putative DNA-binding protein from Streptomyces coelicolor (252 aa), FASTA scores: opt: 148, E(): 0.032, (29.4% identity in 204 aa overlap); and Q9RVM8|DR0999 conserved hypothetical protein from Deinococcus radiodurans (225 aa), FASTA scores: opt: 195, E(): 3.3e-05, (29.6% identity in 213 aa overlap). Also some similarity with O06195|Rv2618|MTCY01A10.15c from Mycobacterium tuberculosis (225 aa), FASTA scores: opt: 149, E(): 0.025, (28.95% identity in 197 aa overlap). Contains helix-turn-helix motif at aa 31-52 (Score 1662, +4.85 SD).;UniProt_AC=I6Y187;Is_Pseudogene=No;Functional_Category=regulatory proteins;Protein Data Bank=;PFAM=O06191;UniProt=I6Y187;Gene Ontology=GO:0006355,GO:0003677;Enzyme Classification=;Drug Resistance Mutations=;InterPro=;UniProtKB/TrEMBL=;SWISS-MODEL=I6Y187",Rv2621c,Rv2621c,Possible transcriptional regulatory protein,regulatory proteins,2950489,2951307,2947462,2947887,FALSE,TRUE,GGCGCAGCCGACGAG,CGCTGGAAGGAGCCA,ATG,-1.159835,5,FALSE,TRUE,-6.768055,9,,4,,GTGA,482,1
CDS,2977231,2978658,-,"Locus=Rv2655c;Name=Rv2655c;Function=Unknown;Product=Possible PhiRv2 prophage protein;Comments=Rv2655c, (MTCY441.24c), len: 475 aa. Hypothetical protein, possibly phiRv2 phage protein (putative primase-like protein) (see citation below). C-terminus similar to P22875|YXIS_SACER hypothetical 28.9 KDA protein (probably does not play a direct role in plasmid integration or excision) from Saccharopolyspora erythraea (Streptomyces erythraeus) plasmid pSE211 (263 aa), FASTA scores: opt: 389, E(): 2.7e-15, (33.45% identity in 269 aa overlap). Weak similarity in N-terminus to O06608|MTCY336.22|Rv1582c Probable phiRV1 phage protein from Mycobacterium tuberculosis (471 aa), FASTA scores: opt: 133, E(): 2.5, (36.0% identity in 75 aa overlap).;UniProt_AC=I6Y1F0;Is_Pseudogene=No;Functional_Category=insertion seqs and phages;Protein Data Bank=;PFAM=P71952;UniProt=I6Y1F0;Gene Ontology=;Enzyme Classification=;Drug Resistance Mutations=;InterPro=;UniProtKB/TrEMBL=;SWISS-MODEL=I6Y1F0",Rv2655c,Rv2655c,Possible PhiRv2 prophage protein,insertion seqs and phages,2978660,2979052,2976989,2977234,FALSE,TRUE,CGGCGGGTGGTGGTC,GCGCTCGGGACGGCG,ATG,-4.478815,9,TRUE,TRUE,-4.49374,7,,4,,ATGA,483,1
CDS,2979049,2979309,-,"Locus=Rv2657c;Name=Rv2657c;Function=Unknown;Product=Probable PhiRv2 prophage protein;Comments=Rv2657c, (MTCY441.26c), len: 86 aa. Probable phiRv2 phage protein (excisionase) (see citation below), similar to O22001|VG36_BPMD2|36|G2 gene 36 protein (GP36) from Mycobacteriophage D29 (56 aa), FASTA scores: opt: 171, E(): 9.6e-06, (48.0% identity in 50 aa overlap); and Q05246|VG36_BPML5|36 gene 36 protein (GP36) from Mycobacteriophage L5 (56 aa), FASTA scores: opt: 169, E(): 1.3e-05, (50% identity in 50 aa overlap). Similarity suggests alternative start at 21737. Contains possible helix-turn-helix motif from aa 33 to 54 (Score 1655, +4.82 SD).;UniProt_AC=I6YE30;Is_Pseudogene=No;Functional_Category=insertion seqs and phages;Protein Data Bank=;PFAM=;UniProt=I6YE30;Gene Ontology=GO:0003677;Enzyme Classification=;Drug Resistance Mutations=;InterPro=;UniProtKB/TrEMBL=;SWISS-MODEL=I6YE30",Rv2657c,Rv2657c,Probable PhiRv2 prophage protein,insertion seqs and phages,2979326,2979688,2978660,2979052,FALSE,TRUE,TAAATTTTCCGGTGC,ACCCGTTCGGTGGTG,ATG,-1.469835,7,FALSE,FALSE,-1.469835,9,,4,,ATGA,484,1
CDS,2981187,2981576,-,"Locus=Rv2661c;Name=Rv2661c;Function=Unknown;Product=Hypothetical protein;Comments=Rv2661c, (MTCY441.30c), len: 129 aa. Hypothetical unknown protein.;UniProt_AC=P71958;Is_Pseudogene=No;Functional_Category=conserved hypotheticals;Protein Data Bank=;PFAM=;UniProt=P71958;Gene Ontology=;Enzyme Classification=;Drug Resistance Mutations=;InterPro=;UniProtKB/TrEMBL=;SWISS-MODEL=",Rv2661c,Rv2661c,Hypothetical protein,conserved hypotheticals,2985731,2986840,2980963,2981190,FALSE,TRUE,CCAGGGGTCGTAGGT,CGGTGGACGCGACAA,ATG,-8.23894,10,TRUE,FALSE,-1.469835,16,,4,,GTGA,485,1
CDS,2991933,2992628,-,"Locus=Rv2676c;Name=Rv2676c;Function=Function unknown;Product=Conserved protein;Comments=Rv2676c, (MTCY441.45c), len: 231 aa. Conserved protein, equivalent to Q9CCB2|ML1045 (alias Q50009|U1764Y but longer 66 aa) hypothetical protein from Mycobacterium leprae (231 aa), FASTA scores: opt: 1401, E(): 8.7e-88, (87.45% identity in 231 aa overlap). Also highly similar to O69830|SC1B5.02 hypothetical 28.1 KDA protein from Streptomyces coelicolor (243 aa), FASTA scores: opt: 915, E(): 7.7e-55, (61.25% identity in 222 aa overlap); and similar to others e.g. Q9RUB0|DR1481 conserved hypothetical protein from Deinococcus radiodurans (289 aa), FASTA scores: opt: 327, E(): 6.1e-15, (31.8% identity in 176 aa overlap); Q97WP2|SSO2169 hypothetical protein from Sulfolobus solfataricus (223 aa), FASTA scores: opt: 285, E(): 3.4e-12, (31.3% identity in 163 aa overlap); BAB59947|TVG0805714 hypothetical protein from Thermoplasma volcanium (223 aa), FASTA scores: opt: 206, E(): 7.7e-07, (25.0% identity in 176 aa overlap); etc.;UniProt_AC=P9WL45;Is_Pseudogene=No;Functional_Category=conserved hypotheticals;Protein Data Bank=;PFAM=P71973;UniProt=P9WL45;Gene Ontology=;Enzyme Classification=;Drug Resistance Mutations=;InterPro=;UniProtKB/TrEMBL=;SWISS-MODEL=P9WL45",Rv2676c,Rv2676c,Conserved protein,conserved hypotheticals,2992634,2993992,2991184,2991936,FALSE,TRUE,AGGTGGCACGATAGA,AGTTGGTGCACTCGC,ATG,-4.02996,16,TRUE,FALSE,-1.469835,13,,4,,ATGA,486,1
