type,start,end,strand,attributes,locus_name,Rv_name,product_name,function_group,prev_start,prev_end,next_start,next_end,overlap_prev,overlap_next,seq_upstream,seq_next_upstream,start_codon,deltaG,RBS_dist,has_RBS,next_has_RBS,next_deltaG,next_RBS_dist,n_overlap_prev,n_overlap_next,seq_overlap_prev,seq_overlap_next,group,frame
CDS,2670269,2671603,-,"Locus=Rv2382c;Name=mbtC;Function=Involved in the biogenesis of the hydroxyphenyloxazoline-containing siderophore mycobactins.;Product=Polyketide synthetase MbtC (polyketide synthase);Comments=Rv2382c, (MTCY22H8.03), len: 444 aa. MbtC, polyketide synthase (see citations below), similar in part to several synthases e.g. Q9F7T9 avermectin polyketide synthase (fragment) from Streptomyces avermitilis (3626 aa), FASTA scores: opt: 1458, E(): 7e-82, (50.65% identity in 446 aa overlap); AAG23264|SPNA polyketide synthase loading and extender module 1 from Saccharopolyspora spinosa (2595 aa) FASTA scores: opt: 1441, E(): 6e-81, (49.1% identity in 446 aa overlap); O33954|TYLG tylactone synthase starter module and modules 1 & 2 from Streptomyces fradiae (4472 aa) FASTA scores: opt: 1439, E(): 1.2e-80, (51.0% identity in 447 aa overlap); O30764|NIDA1 polyketide synthase modules 1 and 2 from Streptomyces caelestis (4340 aa) FASTA scores: opt: 1432, E(): 3.3e-80, (50.9% identity in 442 aa overlap); etc.;UniProt_AC=P71718;Is_Pseudogene=No;Functional_Category=lipid metabolism;Protein Data Bank=;PFAM=P71718;UniProt=P71718;Gene Ontology=GO:0016740,GO:0009058;Enzyme Classification=;Drug Resistance Mutations=;InterPro=;UniProtKB/TrEMBL=;SWISS-MODEL=P71718",mbtC,Rv2382c,Polyketide synthetase MbtC (polyketide synthase),lipid metabolism,2671593,2675837,2667255,2670269,TRUE,TRUE,GCCCGGATGGTGAGT,CCGAGTGTGGGGAGG,ATG,-5.25299,9,TRUE,TRUE,-10.09374,5,11,1,ATGTCCGATAA,A,449,1
CDS,2707333,2708310,-,"Locus=Rv2410c;Name=Rv2410c;Function=Function unknown;Product=Conserved protein;Comments=Rv2410c, (MTCY253.10), len: 325 aa. Conserved protein, equivalent to Q49770|CAC30114|ML0606 conserved hypothetical protein from Mycobacterium leprae (325 aa), FASTA scores: opt: 1928, E(): 3.5e-117, (90.75% identity in 325 aa overlap). Also some similarity with other hypothetical proteins e.g. Q9RST2|DR2041 conserved hypothetical protein from Deinococcus radiodurans (316 aa), FASTA scores: opt: 329, E(): 5.3e-14, (32.4% identity in 318 aa overlap); C-terminus of Q9HUN7|PA4927 hypothetical protein from Pseudomonas aeruginosa (830 aa), FASTA scores: opt: 297, E(): 1.5e-11, (27.6% identity in 315 aa overlap); etc.;UniProt_AC=P71733;Is_Pseudogene=No;Functional_Category=conserved hypotheticals;Protein Data Bank=;PFAM=P71733;UniProt=P71733;Gene Ontology=;Enzyme Classification=;Drug Resistance Mutations=;InterPro=;UniProtKB/TrEMBL=;SWISS-MODEL=",Rv2410c,Rv2410c,Conserved protein,conserved hypotheticals,2708310,2709965,2706494,2707333,TRUE,TRUE,AACAGCAGGCGTTCC,GAAGCCAAGAGGAAT,ATG,-2.032995,12,FALSE,TRUE,-4.40793,8,1,1,A,A,453,1
CDS,2708310,2709965,-,"Locus=Rv2411c;Name=Rv2411c;Function=Function unknown;Product=Conserved hypothetical protein;Comments=Rv2411c, (MTCY253.09c), len: 551 aa. Hypothetical protein, highly similar to Q49755|YO11_MYCLE|ML0605|MLCL536.05c|U1937B|B1937_F1_4 hypothetical 61.8 KDA protein from Mycobacterium leprae (561 aa), FASTA scores, opt: 3163, E(): 4.1e-178, (87.35% identity in 554 aa overlap). Also highly similar, except in N-terminus, to others e.g. Q55587|Y335_SYNY3|SLL0335 hypothetical protein from Synechocystis sp. strain PCC 6803 (481 aa), FASTA scores: opt: 1620, E(): 1.2e-87, (52.8% identity in 468 aa overlap); Q9I307|PA1730 hypothetical protein from Pseudomonas aeruginosa (470 aa), FASTA scores: opt: 1574, E(): 5.8e-85, (52.7% identity in 467 aa overlap); Q9RST1|DR2042 conserved hypothetical protein from Deinococcus radiodurans (655 aa), FASTA scores: opt: 1561, E(): 4.4e-84, (53.3% identity in 467 aa overlap); etc.;UniProt_AC=P9WLA9;Is_Pseudogene=No;Functional_Category=conserved hypotheticals;Protein Data Bank=;PFAM=P65001;UniProt=P9WLA9;Gene Ontology=;Enzyme Classification=;Drug Resistance Mutations=;InterPro=;UniProtKB/TrEMBL=;SWISS-MODEL=P9WLA9",Rv2411c,Rv2411c,Conserved hypothetical protein,conserved hypotheticals,2710351,2711301,2707333,2708310,FALSE,TRUE,ATGTCGAATTTGAGG,AACAGCAGGCGTTCC,ATG,-5.30793,5,TRUE,FALSE,-2.032995,12,,1,,A,454,1
CDS,2723308,2724183,-,"Locus=Rv2426c;Name=Rv2426c;Function=Function unknown;Product=Conserved hypothetical protein;Comments=Rv2426c, (MTCY428.21), len: 291 aa. Conserved hypothetical protein, highly similar to others e.g. Q51326|ORF4 from Pseudomonas carboxydovorans (295 aa), FASTA scores: opt: 853, E(): 3.7e-43, (48.75% identity in 277 aa overlap); BAB47746|MLR0088 from Rhizobium loti (309 aa), FASTA scores: opt :809, E(): 1.5e-40, (46.5% identity in 291 aa overlap); Q9Y9R8|APE2220 from Aeropyrum pernix (297 aa), FASTA scores: opt: 763, E(): 7.4e-38, (47.1% identity in 261 aa overlap); etc. Contains PS00017 ATP/GTP-binding site motif A (P-loop).;UniProt_AC=P71922;Is_Pseudogene=No;Functional_Category=conserved hypotheticals;Protein Data Bank=;PFAM=P71922;UniProt=P71922;Gene Ontology=GO:0016887,GO:0005524;Enzyme Classification=;Drug Resistance Mutations=;InterPro=;UniProtKB/TrEMBL=;SWISS-MODEL=P71922",Rv2426c,Rv2426c,Conserved hypothetical protein,conserved hypotheticals,2724230,2725477,2721866,2723308,FALSE,TRUE,TGCTAGAGGAGACCC,GAGAGCTCAGGTTGA,GTG,-6.768055,10,TRUE,TRUE,-3.82996,8,,1,,G,456,1
CDS,2738247,2739686,-,"Locus=Rv2440c;Name=obg;Function=Essential GTP-binding protein.;Product=Probable GTP1/Obg-family GTP-binding protein Obg;Comments=Rv2440c, (MTCY428.06), len: 479 aa. Probable obg, nucleotide-binding protein, equivalent to Q9CBZ4|ML1465 GTP1/OBG-family GTP-binding protein from Mycobacterium leprae (478 aa), FASTA scores: opt: 1328, E(): 8.4e-70, (58.9% identity in 479 aa overlap). Also highly similar to others e.g. P95722|OBG GTP-binding protein from Streptomyces coelicolor (478 aa), FASTA scores: opt: 1311, E(): 8.2e-69, (60.7% identity in 476 aa overlap); P20964|OBG_BACSU SPO0B-associated GTP-binding protein from Bacillus subtilis (428 aa), FASTA scores: opt: 1006, E(): 3.9e-51, (42.9% identity in 436 aa overlap); Q9KDK0|OBG|BH1213 GTP-binding protein involved in initiation of sporulation from Bacillus halodurans (427 aa), FASTA scores: opt: 978, E(): 1.7e-49, (41.95% identity in 436 aa overlap); etc. Highly similar (identical but shorter 5 aa) to AAK46813|MT2516 GTP-binding protein from Mycobacterium tuberculosis strain CDC1551 (484 aa), FASTA scores: opt: 3205, E(): 7.9e-179, (100% identity in 479 aa overlap). Contains PS00017 ATP/GTP-binding site motif A (P-loop). Belongs to the GTP1/OBG family.;UniProt_AC=P9WMT1;Is_Pseudogene=No;Functional_Category=intermediary metabolism and respiration;Protein Data Bank=;PFAM=P71909;UniProt=P9WMT1;Gene Ontology=GO:0003924,GO:0005737,GO:0005525;Enzyme Classification=;Drug Resistance Mutations=;InterPro=;UniProtKB/TrEMBL=;SWISS-MODEL=P9WMT1",obg,Rv2440c,Probable GTP1/Obg-family GTP-binding protein Obg,intermediary metabolism and respiration,2739772,2740032,2737117,2738247,FALSE,TRUE,GCAGATGAAGGGGAG,GCGAACACGGGGATG,GTG,-7.041975,6,TRUE,TRUE,-4.68185,5,,1,,A,458,1
CDS,2858254,2858724,-,"Locus=Rv2533c;Name=nusB;Function=Involved in the transcription termination process. Interacts with RPSJ|NUSE|Rv0700.;Product=N utilization substance protein NusB (NusB protein);Comments=Rv2533c, (MT2608, MTCY159.23), len: 156 aa. NusB, N utilization substance protein (see citations below), equivalent to Q9CCR9|NUSB_MYCLE|ML0523 N utilization substance protein B from Mycobacterium leprae (190 aa), FASTA scores: opt: 749, E(): 2.6e-41, (75.7% identity in 148 aa overlap). Also highly similar to others e.g. Q9KXR0|SC9C5.14 from Streptomyces coelicolor (142 aa), FASTA scores: opt: 358, E(): 2.7e-16, (45.0% identity in 140 aa overlap); P54520|NUSB_BACSU from Bacillus subtilis (131 aa), FASTA scores: opt: 315, E(): 1.5e-13, (39.55% identity in 129 aa overlap); O83979|NUSB_TREPA|TP1015 from Treponema pallidum (141 aa), FASTA scores: opt: 268, E(): 1.6e-10, (36.95% identity in 138 aa overlap); etc. Belongs to the NusB family.;UniProt_AC=P9WIV1;Is_Pseudogene=No;Functional_Category=information pathways;Protein Data Bank=1EYV;PFAM=P95020;UniProt=P9WIV1;Gene Ontology=GO:0006355,GO:0006353,GO:0003715,GO:0003723;Enzyme Classification=;Drug Resistance Mutations=;InterPro=;UniProtKB/TrEMBL=;SWISS-MODEL=P9WIV1",nusB,Rv2533c,N utilization substance protein NusB (NusB protein),information pathways,2858727,2859290,2857853,2858254,FALSE,TRUE,GCCGGGTCAACGCCT,CGGTGCGTGGGGGGG,ATG,-3.00755,13,FALSE,TRUE,-9.319565,5,,1,,A,473,1
CDS,2937865,2939001,-,"Locus=Rv2610c;Name=pimA;Function=Involved in the first mannosylation step in phosphatidylinositol mannoside biosynthesis (transfer of mannose residues onto PI, leading to the synthesis of phosphatidylinositol monomannoside).;Product=Alpha-mannosyltransferase PimA;Comments=Rv2610c, (MTCY01A10.23), len: 378 aa. PimA, alpha-mannosyltransferase (see citations below), equivalent to O07147|MLCL581.14c|ML0452 putative glycosyltransferase from Mycobacterium leprae (374 aa), FASTA scores: opt: 2044, E(): 8.8e-118, (82.25% identity in 378 aa overlap). N-terminus (from aa 1 to 27) equivalent to Q9FY7 putative alpha-mannosyl transferase (fragment) from Mycobacterium smegmatis (27 aa), blastp scores: 57.4 bits (137), E(): 3e-8, Identities = 25/27 (92%), Positives = 27/27 (99%) (see citation below). Also highly similar to Q9L284|SCL2.15c putative sugar transferase from Streptomyces coelicolor (387 aa), FASTA scores: opt: 1222, E(): 1.8e-67, (52.95% identity in 376 aa overlap); and similar in part to various proteins e.g. Q9YA73|APE2066 long hypothetical N-acetylglucosaminyl-phosphatidylinositol biosynthetic protein from Aeropyrum pernix (392 aa), FASTA scores: opt: 434, E(): 3e-19, (31.5% identity in 378 aa overlap); Q9UZA1|PAB0827 galactosyltransferase or LPS biosynthesis RFBU related protein from Pyrococcus abyssi (371 aa), FASTA scores: opt: 382, E(): 4.3e-16, (28.2% identity in 383 aa overlap); O26275|MTH173 LPS biosynthesis RFBU related protein from Methanothermobacter thermautotrophicus (382 aa), FASTA scores: opt: 372, E(): 1.8e-15, (28.4% identity in 391 aa overlap); etc. Shows also some similarity with O05313|Rv1212c|MTCI364.24c hypothetical 41.5 KDA protein from Mycobacterium tuberculosis (387 aa), FASTA scores: opt: 232, E(): 1.1e -07, (28.4% identity in 402 aa overlap). Contains PS00017 ATP/GTP-binding site motif A (P-loop).;UniProt_AC=P9WMZ5;Is_Pseudogene=No;Functional_Category=lipid metabolism;Protein Data Bank=;PFAM=O06204;UniProt=P9WMZ5;Gene Ontology=GO:0009405,GO:0043750,GO:0008654,GO:0005886,GO:0016021;Enzyme Classification=2.4.1.57;Drug Resistance Mutations=;InterPro=;UniProtKB/TrEMBL=;SWISS-MODEL=P9WMZ5",pimA,Rv2610c,Alpha-mannosyltransferase PimA,lipid metabolism,2939012,2939962,2936810,2937865,FALSE,TRUE,TCCAGATGAGGAAAG,AGGTTCAGGTGGCCA,ATG,-4.468055,6,TRUE,TRUE,-8.013115,10,,1,,A,480,1
CDS,3101581,3102162,-,"Locus=Rv2792c;Name=Rv2792c;Function=Prevents the cointegration of foreign DNA before integration into the chromosome.;Product=Possible resolvase;Comments=Rv2792c, (MTV002.57c), len: 193 aa. Possible IS1602 resolvase, highly similar to many from Mycobacterium tuberculosis e.g. O07773|Rv0605|MTCY19H5.17c possible resolvase (202 aa), FASTA scores: opt: 1040, E(): 1.9e-62, (85.05% identity in 194 aa overlap). Contains PS00397 Site-specific recombinases active site and possible helix-turn-helix motif at aa 1-2 (Score 1687, +4.93 SD).;UniProt_AC=I6YA93;Is_Pseudogene=No;Functional_Category=insertion seqs and phages;Protein Data Bank=;PFAM=O33334;UniProt=I6YA93;Gene Ontology=GO:0006310,GO:0000150,GO:0003677;Enzyme Classification=;Drug Resistance Mutations=;InterPro=;UniProtKB/TrEMBL=;SWISS-MODEL=I6YA93",Rv2792c,Rv2792c,Possible resolvase,insertion seqs and phages,3102364,3103260,3100202,3101581,FALSE,TRUE,GTGCTGTAGGAACAA,AAGAGTCGGAGGCTG,ATG,-4.20793,10,TRUE,TRUE,-6.856025,8,,1,,A,499,1
CDS,3105619,3107307,-,"Locus=Rv2797c;Name=Rv2797c;Function=Function unknown;Product=Conserved hypothetical protein;Comments=Rv2797c, (MTCY16B7.46), len: 562 aa. Conserved hypothetical ala-rich protein. C-terminus highly similar to several mycobacterial proteins e.g. AAK46927|MT2616 hypothetical 28.0 KDA protein from Mycobacterium tuberculosis strain CDC1551 (265 aa), FASTA scores: opt: 535, E(): 4.6e-22, (42.95% identity in 263 aa overlap); P95011|Rv2542|MTCY159.14c hypothetical 42.4 KDA protein from Mycobacterium tuberculosis (403 aa), FASTA scores: opt: 537, E(): 5e-22, (40.75% identity in 292 aa overlap) (similarity in the second half of protein); P71547|Y963_MYCTU|Rv0963c|MT0992|MTCY10D7.11 hypothetical 28.1 KDA protein (266 aa), FASTA scores: opt: 314, E(): 5.7e-10, (39.0% identity in 254 aa overlap); etc. Contains PS00120 Lipases, serine active site.;UniProt_AC=P71654;Is_Pseudogene=No;Functional_Category=conserved hypotheticals;Protein Data Bank=;PFAM=P71654;UniProt=P71654;Gene Ontology=;Enzyme Classification=;Drug Resistance Mutations=;InterPro=;UniProtKB/TrEMBL=;SWISS-MODEL=P71654",Rv2797c,Rv2797c,Conserved hypothetical protein,conserved hypotheticals,3107311,3107637,3105056,3105619,FALSE,TRUE,TCCGCGTGGGGTGTG,CACTGAGAGGGGGAC,GTG,-5.13072,8,TRUE,TRUE,-9.241975,8,,1,,A,501,1
CDS,3145171,3147873,-,"Locus=Rv2839c;Name=infB;Function=If-2, one of the essential components for the initiation of protein synthesis in vitro, protects formylmethionyl-tRNA from spontaneous hydrolysis and promotes its binding to the 30S ribosomal subunits. It is also involved in the hydrolysis of GTP during the formation of the 70S ribosomal complex.;Product=Probable translation initiation factor if-2 InfB;Comments=Rv2839c, (MTCY16B7.03), len: 900 aa. Probable infB, translation initiation factor if-2, highly similar, but in part, to Q9Z5I9|IF2_MYCLE|ML1556|MLCB596.14 translation initiation factor if-2 from Mycobacterium leprae (924 aa), FASTA scores: opt: 4548, E(): 2.4e-132, (83.6% identity in 933 aa overlap). Also similar in part to others e.g. Q9K3E2|SC5H4.30 from Streptomyces coelicolor (835 aa), FASTA scores: opt: 2559, E(): 1.3e-71, (59.9% identity in 833 aa overlap); P17889|IF2_BACSU|INFB from Bacillus subtilis (716 aa), FASTA scores: opt: 1782, E(): 6.6e-48, (46.65% identity in 686 aa overlap); P02995|IF2_ECOLI|INFB|SSYG|B3168|Z4529|ECS4049 from Escherichia coli strains O157:H7 and K12 (890 aa), FASTA scores: opt: 1708, E(): 1.3e-45, (46.2% identity in 662 aa overlap); etc. Contains PS00017 ATP/GTP-binding site motif A (P-loop). Belongs to the if-2 family.;UniProt_AC=P9WKK1;Is_Pseudogene=No;Functional_Category=information pathways;Protein Data Bank=;PFAM=P65131;UniProt=P9WKK1;Gene Ontology=GO:0003924,GO:0005737,GO:0003743,GO:0006413,GO:0005525;Enzyme Classification=;Drug Resistance Mutations=;InterPro=;UniProtKB/TrEMBL=;SWISS-MODEL=P9WKK1",infB,Rv2839c,Probable translation initiation factor if-2 InfB,information pathways,3147959,3148258,3144620,3145171,FALSE,TRUE,CTCATGGACAGGAGA,TCCAGAAGGAACGCG,GTG,-6.468055,7,TRUE,TRUE,-4.71615,6,,1,,A,510,1
CDS,3157521,3158144,-,"Locus=Rv2849c;Name=cobO;Function=Involved in cobalamin biosynthesis; transforms cobyrinic acid into cobinamide [catalytic activity: ATP + cob(I)alamin + H(2)O = orthophosphate + pyrophosphate + adenosylcobalamin].;Product=Probable cob(I)alamin adenosyltransferase CobO (corrinoid adenosyltransferase) (corrinoid adotransferase activity);Comments=Rv2849c, (MTCY24A1.08), len: 207 aa. Probable cobO, cob(I)alamin adenosyltransferase, highly similar to Q9RJ17|COBO from Streptomyces coelicolor (199 aa), FASTA scores: opt: 918, E(): 1.1e-55, (64.75% identity in 207 aa overlap); and similar to others e.g. O30785|COBO from Rhodobacter capsulatus (Rhodopseudomonas capsulata) (212 aa), FASTA scores: opt: 329, E(): 2.8e-15, (44.3% identity in 185 aa overlap); P29930|COBO_PSEDE from Pseudomonas denitrificans (213 aa), FASTA scores: opt: 280, E(): 6.5e-12, (38.9% identity in 185 aa overlap); P31570|BTUR_SALTY|COBA from Salmonella typhimurium (196 aa), FASTA scores: opt: 278, E(): 8.4e-12, (39.8% identity in 196 aa overlap); etc. Cofactor: manganese. Note that previously known as cobA.;UniProt_AC=I6Y1V6;Is_Pseudogene=No;Functional_Category=intermediary metabolism and respiration;Protein Data Bank=;PFAM=Q7D6G6;UniProt=I6Y1V6;Gene Ontology=GO:0008817,GO:0009236,GO:0005524;Enzyme Classification=2.5.1.17;Drug Resistance Mutations=;InterPro=;UniProtKB/TrEMBL=;SWISS-MODEL=I6Y1V6",cobO,Rv2849c,Probable cob(I)alamin adenosyltransferase CobO (corrinoid adenosyltransferase) (corrinoid adotransferase activity),intermediary metabolism and respiration,3158165,3160054,3156148,3157521,FALSE,TRUE,GATGGATAGGTAACC,AGAAGGGCATCGAGT,ATG,-6.15299,9,TRUE,TRUE,-4.456165,14,,1,,A,512,1
CDS,3207942,3208328,-,"Locus=Rv2898c;Name=Rv2898c;Function=Function unknown;Product=Conserved hypothetical protein;Comments=Rv2898c, (MTCY274.29c), len: 128 aa. Conserved hypothetical protein, highly similar to O33024|YS98_MYCLE|ML1607|MLCB250.49 hypothetical 11.0 KDA protein from Mycobacterium leprae (96 aa), FASTA scores: opt: 318, E(): 2.3e-16, (58.35% identity in 96 aa overlap). Also similar to other hypothetical proteins e.g. O69890|YE19_STRCO|SC2E1.19 from Streptomyces coelicolor (130 aa), FASTA scores: opt: 253, E(): 1.7e-11, (39.65% identity in 121 aa overlap); Q9HVZ1|PA4424 from Pseudomonas aeruginosa (125 aa), FASTA scores: opt: 234, E(): 4.2e-10, (40.85% identity in 115 aa overlap); O86871 from Streptomyces lividans (85 aa), FASTA scores: opt: 224, E(): 1.8e-09, (46.45% identity in 84 aa overlap); etc. Equivalent to AAK47292 from Mycobacterium tuberculosis strain CDC1551 (141 aa) but shorter 13 aa. A core mycobacterial gene; conserved in mycobacterial strains (See Marmiesse et al., 2004).;UniProt_AC=P9WFM9;Is_Pseudogene=No;Functional_Category=conserved hypotheticals;Protein Data Bank=;PFAM=P67230;UniProt=P9WFM9;Gene Ontology=GO:0003677;Enzyme Classification=;Drug Resistance Mutations=;InterPro=;UniProtKB/TrEMBL=;SWISS-MODEL=P9WFM9",Rv2898c,Rv2898c,Conserved hypothetical protein,conserved hypotheticals,3208576,3209406,3206431,3207942,FALSE,TRUE,CAGCGTGCAGGTTGG,ACCTGCAGGGGATCG,ATG,-3.82996,8,TRUE,TRUE,-7.141975,6,,1,,A,517,1
CDS,3209406,3211745,-,"Locus=Rv2900c;Name=fdhF;Function=Decomposes formic acid to hydrogen and carbon dioxide under anaerobic conditions in the absence of exogenous electron acceptors [catalytic activity: formate + NAD(+) = CO(2) + NADH].;Product=Possible formate dehydrogenase H FdhF (formate-hydrogen-lyase-linked, selenocysteine-containing polypeptide) (formate dehydrogenase-H alpha subunit) (FDH-H);Comments=Rv2900c, (MTCY274.31c), len: 779 aa. Possible fdhF, formate dehydrogenase, highly similar to others formate dehydrogenases and prokaryotic molybdopterin-containing oxidoreductases e.g. Q9S2J9|SC7H2.18 putative formate dehydrogenase from Streptomyces coelicolor (759 aa), FASTA scores: opt: 3038, E(): 2.7e-180, (59.7% identity in 767 aa overlap); Q9HU08|PA5181 probable oxidoreductase from Pseudomonas aeruginosa (773 aa), FASTA scores: opt: 2560, E(): 1.1e-150, (53.2% identity in 761 aa overlap); P78160 formate dehydrogenase a chain (fragment) from Escherichia coli strain K12 (740 aa), FASTA scores: opt: 2002, E(): 3.7e-116, (43.1% identity in 733 aa overlap); P07658|FDHF_ECOLI|P78137|B4079 formate dehydrogenase from Escherichia coli strain K12 (715 aa), FASTA scores: opt: 305, E(): 5.6e-13, (25.5% identity in 748 aa overlap); etc. Belongs to the prokaryotic molybdopterin-containing oxidoreductase family.;UniProt_AC=P9WJP9;Is_Pseudogene=No;Functional_Category=intermediary metabolism and respiration;Protein Data Bank=;PFAM=P65408;UniProt=P9WJP9;Gene Ontology=GO:0008863,GO:0030151,GO:0055114,GO:0051539;Enzyme Classification=;Drug Resistance Mutations=;InterPro=;UniProtKB/TrEMBL=;SWISS-MODEL=P9WJP9",fdhF,Rv2900c,"Possible formate dehydrogenase H FdhF (formate-hydrogen-lyase-linked, selenocysteine-containing polypeptide) (formate dehydrogenase-H alpha subunit) (FDH-H)",intermediary metabolism and respiration,3211803,3212108,3208576,3209406,FALSE,TRUE,GGCAGTCGGTCGGTC,GATTGGAGCCAACGG,ATG,-1.469835,10,FALSE,TRUE,-3.60793,12,,1,,G,518,1
CDS,3335164,3335748,-,"Locus=Rv2979c;Name=Rv2979c;Function=Prevents the cointegration of foreign DNA before integration into the chromosome.;Product=Probable resolvase;Comments=Rv2979c, (MTCY349.08), len: 194 aa. Probable resolvase for IS1538, with low level matches to transposon resolvases; highly similar from aa 101 to YX1C_MYCTU|Q10831 from Mycobacterium tuberculosis (295 aa), FASTA scores: opt: 809, E(): 0, (69.1% identity in 194 aa overlap). Contains PS00397 Site-specific recombinases active site, and possible helix-turn-helix motiv at aa 2-23.;UniProt_AC=I6XFU1;Is_Pseudogene=No;Functional_Category=insertion seqs and phages;Protein Data Bank=;PFAM=P95116;UniProt=I6XFU1;Gene Ontology=GO:0006310,GO:0000150,GO:0003677;Enzyme Classification=;Drug Resistance Mutations=;InterPro=;UniProtKB/TrEMBL=;SWISS-MODEL=I6XFU1",Rv2979c,Rv2979c,Probable resolvase,insertion seqs and phages,3336796,3337917,3333785,3335164,FALSE,TRUE,GTGCGGTAGGAACAG,AGGACCATGAGGCCG,ATG,-4.20793,10,TRUE,TRUE,-4.21615,8,,1,,A,526,1
CDS,3361130,3362986,-,"Locus=Rv3003c;Name=ilvB1;Function=Involved in valine and isoleucine biosynthesis (at the first step) [catalytic activity: 2-acetolactate + CO(2) = 2 pyruvate].;Product=Acetolactate synthase (large subunit) IlvB1 (acetohydroxy-acid synthase);Comments=Rv3003c, (MT3083, MTV012.17c), len: 618 aa. ilvB1, acetolactate synthase, large subunit, equivalent or highly similar to others e.g. O33112|ILVB_MYCLE|MLCB637.20|ML1696 from Mycobacterium leprae (625 aa), FASTA scores: opt: 3653, E(): 5.4e-208, (87.1% identity in 627 aa overlap); Q59498|ILVB_MYCAV from Mycobacterium avium (621 aa), FASTA scores: opt: 3473, E(): 2.3e-197, (84.7% identity in 614 aa overlap); P42463|ILVB_CORGL from Corynebacterium glutamicum (Brevibacterium flavum) (626 aa), FASTA scores: opt: 2754, E(): 5.9e-155, (65.8% identity in 589 aa overlap); etc. Contains PS00187 Thiamine pyrophosphate enzymes signature. Cofactor: thiamine pyrophosphate, and magnesium (by similarity). Note that previously known as ilvB.;UniProt_AC=P9WG41;Is_Pseudogene=No;Functional_Category=intermediary metabolism and respiration;Protein Data Bank=;PFAM=P0A622;UniProt=P9WG41;Gene Ontology=GO:0003984,GO:0009082,GO:0000287,GO:0030976,GO:0050660;Enzyme Classification=2.2.1.6;Drug Resistance Mutations=;InterPro=;UniProtKB/TrEMBL=;SWISS-MODEL=P9WG41",ilvB1,Rv3003c,Acetolactate synthase (large subunit) IlvB1 (acetohydroxy-acid synthase),intermediary metabolism and respiration,3363029,3363152,3360624,3361130,FALSE,TRUE,AATAGAGGATCACAC,TCACCGAAGGCCACG,GTG,-4.40793,12,TRUE,FALSE,-2.332995,11,,1,,A,529,1
CDS,3624910,3626613,-,"Locus=Rv3245c;Name=mtrB;Function=Sensor part of a two component regulatory system.;Product=Two component sensory transduction histidine kinase MtrB;Comments=Rv3245c, (MTCY20B11.20c), len: 567 aa. MtrB, sensor-like histidine kinase (see citations below), equivalent to Q9CCJ1|MTRB or ML0774 putative two-component system sensor kinase from Mycobacterium leprae (562 aa), FASTA scores: opt: 3208, E(): 7.4e-173, (88.7% identity in 566 aa overlap). Also similar to others e.g. Q9KYW9|SCE33.14c putative two-component system histidine kinase from Streptomyces coelicolor (688 aa), FASTA scores: opt: 1355, E(): 1.1e-68, (48.95% identity in 515 aa overlap); etc. Relatives in Mycobacterium tuberculosis are: MTCY369.03, E(): 1.5e-22; MTCY20G9.16, E(): 1.9e-17. Similar to other prokaryotic sensory transduction histidine kinases.;UniProt_AC=P9WGK9;Is_Pseudogene=No;Functional_Category=regulatory proteins;Protein Data Bank=;PFAM=Q50496;UniProt=P9WGK9;Gene Ontology=GO:0016021,GO:0018106,GO:0005886,GO:0007165,GO:0000155,GO:0000160,GO:0005524;Enzyme Classification=2.7.13.3;Drug Resistance Mutations=;InterPro=;UniProtKB/TrEMBL=;SWISS-MODEL=P9WGK9",mtrB,Rv3245c,Two component sensory transduction histidine kinase MtrB,regulatory proteins,3626663,3627349,3623159,3624910,FALSE,TRUE,ATGCTAAGGAGCGGC,ACGCGGAGTGGAGCG,ATG,-6.91615,7,TRUE,TRUE,-4.656025,5,,1,,A,543,1
