type,start,end,strand,attributes,locus_name,Rv_name,product_name,function_group,prev_start,prev_end,next_start,next_end,overlap_prev,overlap_next,seq_upstream,seq_next_upstream,start_codon,deltaG,RBS_dist,has_RBS,next_has_RBS,next_deltaG,next_RBS_dist,n_overlap_prev,n_overlap_next,seq_overlap_prev,seq_overlap_next,group,frame
CDS,3280,4437,+,"Locus=Rv0003;Name=recF;Function=The RECF protein is involved in DNA metabolism and recombination; it is required for DNA replication and normal sos inducibility. RECF binds preferentially to single-stranded, linear DNA. It also seems to bind ATP.;Product=DNA replication and repair protein RecF (single-strand DNA binding protein);Comments=Rv0003, (MTCY10H4.01), len: 385 aa. RecF, DNA replication and repair protein (see citations below), equivalent to other mycobacterial DNA replication and repair proteins. Also highly similar to many others. Contains PS00017 ATP/GTP-binding site motif A (P-loop), PS00617 RecF protein signature 1, and PS00618 RecF protein signature 2. Belongs to the RecF family.;UniProt_AC=P9WHI9;Is_Pseudogene=No;Functional_Category=information pathways;Protein Data Bank=;PFAM=Q59586;UniProt=P9WHI9;Gene Ontology=GO:0006281,GO:0006260,GO:0009432,GO:0005737,GO:0003697,GO:0005524;Enzyme Classification=;Drug Resistance Mutations=;InterPro=;UniProtKB/TrEMBL=;SWISS-MODEL=P9WHI9",recF,Rv0003,DNA replication and repair protein RecF (single-strand DNA binding protein),information pathways,2052,3260,4434,4997,FALSE,TRUE,GCACTTGGCGCCCGG,CGATGTCGGTGGTTC,GTG,-0.872870000000002,5,FALSE,FALSE,-1.469835,10,,4,,ATGA,1,1
CDS,27595,28365,+,"Locus=Rv0023;Name=Rv0023;Function=Possibly involved in transcriptional mechanism.;Product=Possible transcriptional regulatory protein;Comments=Rv0023, (MTCY10H4.23), len: 256 aa. Possible transcriptional regulator. Contains probable helix-turn helix motif from aa 19 to 40 (Score 1615, +4.69 SD).;UniProt_AC=P9WMI3;Is_Pseudogene=No;Functional_Category=regulatory proteins;Protein Data Bank=;PFAM=P67704;UniProt=P9WMI3;Gene Ontology=GO:0043565,GO:0006350,GO:0045449;Enzyme Classification=;Drug Resistance Mutations=;InterPro=;UniProtKB/TrEMBL=;SWISS-MODEL=P9WMI3",Rv0023,Rv0023,Possible transcriptional regulatory protein,regulatory proteins,25644,25726,28362,29207,FALSE,TRUE,CTTATGGCCGGAGCG,ACGCGGATGAGGGGC,GTG,-4.656025,5,TRUE,TRUE,-5.99388,7,,4,,GTGA,2,1
CDS,34295,36610,+,"Locus=Rv0032;Name=bioF2;Function=Could be involved in biotin biosynthesis (at the first step) [catalytic activity: 6-carboxyhexanoyl-CoA + L-alanine = 8-amino-7-oxononanoate + CoA + CO2].;Product=Possible 8-amino-7-oxononanoate synthase BioF2 (AONS) (8-amino-7-ketopelargonate synthase) (7-keto-8-amino-pelargonic acid synthetase) (7-KAP synthetase) (L-alanine--pimelyl CoA ligase);Comments=Rv0032, (MTCY10H4.32), len: 771 aa. Probable bioF2, 8-amino-7-oxononanoate synthase, with its C-terminal similar to others. Contains PS00599 Aminotransferases class-II pyridoxal-phosphate attachment site. Belongs to class-II of pyridoxal-phosphate-dependent aminotransferases.;UniProt_AC=P9WQ85;Is_Pseudogene=No;Functional_Category=intermediary metabolism and respiration;Protein Data Bank=;PFAM=P71602;UniProt=P9WQ85;Gene Ontology=GO:0008415,GO:0009058,GO:0016874,GO:0030170,GO:0008483,GO:0008710;Enzyme Classification=2.3.1.47;Drug Resistance Mutations=;InterPro=;UniProtKB/TrEMBL=;SWISS-MODEL=P9WQ85",bioF2,Rv0032,Possible 8-amino-7-oxononanoate synthase BioF2 (AONS) (8-amino-7-ketopelargonate synthase) (7-keto-8-amino-pelargonic acid synthetase) (7-KAP synthetase) (L-alanine--pimelyl CoA ligase),intermediary metabolism and respiration,33582,33794,36607,36870,FALSE,TRUE,GAATCTTCCGGGCGG,CCCCGCAAGGAGCCG,ATG,-3.88185,5,TRUE,TRUE,-8.61615,6,,4,,ATGA,3,1
CDS,36607,36870,+,"Locus=Rv0033;Name=acpA;Function=Key component in de novo fatty acid biosynthesis. This protein is supposed to be the carrier of the growing fatty acid chain in fatty acid biosynthesis.;Product=Probable acyl carrier protein AcpA (ACP);Comments=Rv0033, (MTCY10H4.33), len: 87 aa. Probable acpA (alternate gene name: acpP), acyl carrier protein, similar to others. Also similar to proteins of Mycobacterium tuberculosis Rv1344 and Rv2244 (31.5% identity in 73 aa overlap).;UniProt_AC=I6WX95;Is_Pseudogene=No;Functional_Category=lipid metabolism;Protein Data Bank=2CGQ;PFAM=P71603;UniProt=I6WX95;Gene Ontology=GO:0048037,GO:0000036;Enzyme Classification=;Drug Resistance Mutations=;InterPro=;UniProtKB/TrEMBL=;SWISS-MODEL=I6WX95",acpA,Rv0033,Probable acyl carrier protein AcpA (ACP),lipid metabolism,34295,36610,36867,37262,TRUE,TRUE,CCCCGCAAGGAGCCG,CACTTGGGAAAGGAA,ATG,-8.61615,6,TRUE,TRUE,-5.29374,7,4,4,ATGA,ATGA,3,1
CDS,36867,37262,+,"Locus=Rv0034;Name=Rv0034;Function=Function unknown;Product=Conserved hypothetical protein;Comments=Rv0034, (MTCY10H4.34), len: 131 aa. Conserved hypothetical protein, showing weak similarity to AE001980|AE001980_7 hypothetical protein from Deinococcus radiodurans (120 aa), FASTA scores: opt: 141, E(): 0.0028, (29.3% identity in 123 aa overlap).;UniProt_AC=P9WM93;Is_Pseudogene=No;Functional_Category=conserved hypotheticals;Protein Data Bank=;PFAM=;UniProt=P9WM93;Gene Ontology=;Enzyme Classification=;Drug Resistance Mutations=;InterPro=;UniProtKB/TrEMBL=;SWISS-MODEL=P9WM93",Rv0034,Rv0034,Conserved hypothetical protein,conserved hypotheticals,36607,36870,37259,38947,TRUE,TRUE,CACTTGGGAAAGGAA,CGACCGAAAGCTTCT,ATG,-5.29374,7,TRUE,FALSE,0.9151,11,4,4,ATGA,ATGA,3,1
CDS,53663,55699,+,"Locus=Rv0050;Name=ponA1;Function=Involved in peptidoglycan synthesis (at the final stages), cell wall formation. Synthesis of cross-linked peptidoglycan from the lipid intermediates. The enzyme has a penicillin-insensitive transglycosylase N-terminal domain (formation of linear glycan strands) and a penicillin-sensitive transpeptidase C-terminal domain (cross-linking of the peptide subunits).;Product=Probable bifunctional penicillin-binding protein 1A/1B PonA1 (murein polymerase) (PBP1): penicillin-insensitive transglycosylase (peptidoglycan TGASE) + penicillin-sensitive transpeptidase (DD-transpeptidase);Comments=Rv0050, (MTCY21D4.13), len: 678 aa. Probable ponA1, penicillin-binding protein (class A), bienzymatic protein with transglycosylase and transpeptidase activities (see Graham & Clark-Curtiss 1999), highly similar to many (see Billman-Jacobe et al., 1999). Belongs to the transglycosylase family in the N-terminal section, and to the transpeptidase family in the C-terminal section.;UniProt_AC=P71707;Is_Pseudogene=No;Functional_Category=cell wall and cell processes;Protein Data Bank=;PFAM=P71707;UniProt=P71707;Gene Ontology=GO:0016787,GO:0008658,GO:0009252,GO:0009274,GO:0008360,GO:0016757,GO:0007047;Enzyme Classification=3.4.-.-,2.4.2.-;Drug Resistance Mutations=;InterPro=;UniProtKB/TrEMBL=;SWISS-MODEL=P71707",ponA1,Rv0050,Probable bifunctional penicillin-binding protein 1A/1B PonA1 (murein polymerase) (PBP1): penicillin-insensitive transglycosylase (peptidoglycan TGASE) + penicillin-sensitive transpeptidase (DD-transpeptidase),cell wall and cell processes,52831,53244,55696,57378,FALSE,TRUE,GCTGTACCTCACCGC,CGACTCCCACGCCGC,GTG,1.67826,15,FALSE,FALSE,2.00029,17,,4,,GTGA,4,1
CDS,88204,89025,+,"Locus=Rv0079;Name=Rv0079;Function=Unknown;Product=Unknown protein;Comments=Rv0079, (MTV030.23), len: 273 aa. Unknown protein. Predicted possible vaccine candidate (See Zvi et al., 2008).;UniProt_AC=P9WMA9;Is_Pseudogene=No;Functional_Category=conserved hypotheticals;Protein Data Bank=;PFAM=;UniProt=P9WMA9;Gene Ontology=;Enzyme Classification=;Drug Resistance Mutations=;InterPro=;UniProtKB/TrEMBL=;SWISS-MODEL=P9WMA9",Rv0079,Rv0079,Unknown protein,conserved hypotheticals,86528,87133,89022,89480,FALSE,TRUE,ACAATCGAAAGCCGA,GCGTTGCCGACGGTC,GTG,0.9151,10,FALSE,FALSE,-1.469835,6,,4,,ATGA,7,1
CDS,89924,90403,+,"Locus=Rv0082;Name=Rv0082;Function=Function unknown; probably involved in cellular metabolism.;Product=Probable oxidoreductase;Comments=Rv0082, (MTV030.26), len: 159 aa. Probable oxidoreductase, highly similar or similar to other various oxidoreductases. Nucleotide position 90144 in the genome sequence has been corrected, A:G resulting in Q74R.;UniProt_AC=I6XUD2;Is_Pseudogene=No;Functional_Category=intermediary metabolism and respiration;Protein Data Bank=;PFAM=O53627;UniProt=I6XUD2;Gene Ontology=GO:0008137,GO:0055114,GO:0048038,GO:0051539;Enzyme Classification=1.-.-.-;Drug Resistance Mutations=;InterPro=;UniProtKB/TrEMBL=;SWISS-MODEL=I6XUD2",Rv0082,Rv0082,Probable oxidoreductase,intermediary metabolism and respiration,89575,89919,90400,92322,FALSE,TRUE,GGCTCGGCCACGTAA,TGCGATCGGTGACCG,ATG,0.727129999999998,18,FALSE,FALSE,-1.469835,10,,4,,ATGA,8,1
CDS,93951,95417,+,"Locus=Rv0086;Name=hycQ;Function=Possibly involved in hydrogen metabolism.;Product=Possible hydrogenase HycQ;Comments=Rv0086, (MTCY251.04), len: 488 aa. Possible hycQ, hydrogenase, integral membrane protein. Belongs to the NADH-Ubiquinone/plastoquinone (complex I) superfamily.;UniProt_AC=Q10883;Is_Pseudogene=No;Functional_Category=intermediary metabolism and respiration;Protein Data Bank=;PFAM=Q10883;UniProt=Q10883;Gene Ontology=GO:0008137,GO:0016021,GO:0042773;Enzyme Classification=1.-.-.-;Drug Resistance Mutations=;InterPro=;UniProtKB/TrEMBL=;SWISS-MODEL=",hycQ,Rv0086,Possible hydrogenase HycQ,intermediary metabolism and respiration,93289,93951,95414,96892,TRUE,TRUE,TGCGGGAGTTGCGGG,CCAGCAACGTGGGTC,ATG,-5.29374,9,TRUE,FALSE,-3.00755,6,1,4,A,GTGA,9,1
CDS,106734,107603,+,"Locus=Rv0097;Name=Rv0097;Function=Function unknown; probably involved in cellular metabolism.;Product=Possible oxidoreductase;Comments=Rv0097, (MTCY251.16), len: 289 aa. Possible oxidoreductase, equivalent to NP_302343.1|NC_002677 putative oxidoreductase from Mycobacterium leprae (289 aa). Also highly similar to BAB69377.1|AB070955 putative oxidoreductase from Streptomyces avermitilis (296 aa). Contains PS00077 Cytochrome c oxidase subunit I, copper B binding region signature.;UniProt_AC=P9WG83;Is_Pseudogene=No;Functional_Category=intermediary metabolism and respiration;Protein Data Bank=;PFAM=P67755;UniProt=P9WG83;Gene Ontology=GO:0055114,GO:0016702,GO:0046872;Enzyme Classification=1.-.-.-;Drug Resistance Mutations=;InterPro=;UniProtKB/TrEMBL=;SWISS-MODEL=P9WG83",Rv0097,Rv0097,Possible oxidoreductase,intermediary metabolism and respiration,105324,106715,107600,108151,FALSE,TRUE,AACAAGGAGAAAAGA,AGACGCCGGGATACG,ATG,-6.768055,12,TRUE,FALSE,-2.78552,9,,4,,ATGA,10,1
CDS,148491,148859,+,"Locus=Rv0122;Name=Rv0122;Function=Unknown;Product=Hypothetical protein;Comments=Rv0122, (MTCI418B.04), len: 122 aa. Hypothetical unknown protein.;UniProt_AC=O07172;Is_Pseudogene=No;Functional_Category=conserved hypotheticals;Protein Data Bank=;PFAM=;UniProt=O07172;Gene Ontology=;Enzyme Classification=;Drug Resistance Mutations=;InterPro=;UniProtKB/TrEMBL=;SWISS-MODEL=O07172",Rv0122,Rv0122,Hypothetical protein,conserved hypotheticals,144049,145626,148856,149224,FALSE,TRUE,CCAGTGGCGCGCAAG,TGCCGAAGGAGTGGA,TTG,0.1151,6,FALSE,TRUE,-6.91615,7,,4,,ATGA,13,1
CDS,184723,185055,+,"Locus=Rv0156;Name=pntAb;Function=The transhydrogenation between NADH and NADP is coupled to respiration and ATP hydrolysis and functions as a proton pump across the membrane [catalytic activity: NADPH + NAD+ = NADP+ + NADH].;Product=Probable NAD(P) transhydrogenase (subunit alpha) PntAb [second part; integral membrane protein] (pyridine nucleotide transhydrogenase subunit alpha) (nicotinamide nucleotide transhydrogenase subunit alpha);Comments=Rv0156, (MTCI5.30), len: 110 aa. Probable pntAb, second part of NAD(P) transhydrogenase subunit alpha, integral membrane protein, similar to C-terminus of others e.g. Q59764 nicotinamide nucleotide transhydrogenase subunit PNTAB (139 aa), FASTA scores: opt: 247, E(): 1.9e-11, (45.5% identity in 88 aa overlap).;UniProt_AC=P96833;Is_Pseudogene=No;Functional_Category=intermediary metabolism and respiration;Protein Data Bank=;PFAM=;UniProt=P96833;Gene Ontology=;Enzyme Classification=;Drug Resistance Mutations=;InterPro=;UniProtKB/TrEMBL=;SWISS-MODEL=P96833",pntAb,Rv0156,Probable NAD(P) transhydrogenase (subunit alpha) PntAb [second part; integral membrane protein] (pyridine nucleotide transhydrogenase subunit alpha) (nicotinamide nucleotide transhydrogenase subunit alpha),intermediary metabolism and respiration,183622,184722,185052,186479,FALSE,TRUE,CCGCGGGAAGGACTC,ACCGCGACGAGGCGC,ATG,-4.49374,9,TRUE,TRUE,-3.60793,8,,4,,ATGA,14,1
CDS,198534,199898,+,"Locus=Rv0169;Name=mce1A;Function=Unknown, but thought to be involved in host cell invasion (entry and survival inside macrophages).;Product=Mce-family protein Mce1A;Comments=Rv0169, (MTCI28.09), len: 454 aa. Mce1A; belongs to 24-membered Mycobacterium tuberculosis Mce protein family (see citations below), highly similar to Mycobacterium tuberculosis proteins O07789|MCE2|Rv0589|MTCY19H5.33c|mce2A (404 aa); O53967|MCE3|Rv1966|MTV051.04|mce3A (425 aa); etc. Also highly similar to others e.g. AAD52105.1|AF113402_1|AF113402 mycobacterial cell entry protein from Mycobacterium bovis BCG (454 aa); NP_302656.1|NC_002677 putative cell invasion protein from Mycobacterium leprae (441 aa); AAA92845.1|U26018 mce gene product from Mycobacterium avium (88 aa) (similarity on C-terminus); CAC12798.1|AL445327 putative secreted protein from Streptomyces coelicolor (418 aa); etc. Note that equivalent, but longer 22 aa, to P72013|CAA50257.1|X70901 Mcep protein from Mycobacterium tuberculosis (432 aa). Contains a very hydrophobic region around residues 20-35. Note that previously known as mce1. A core mycobacterial gene; conserved in mycobacterial strains (See Marmiesse et al., 2004). Predicted to be an outer membrane protein (See Song et al., 2008).;UniProt_AC=Q79FZ9;Is_Pseudogene=No;Functional_Category=virulence, detoxification, adaptation;Protein Data Bank=;PFAM=Q79FZ9;UniProt=Q79FZ9;Gene Ontology=;Enzyme Classification=;Drug Resistance Mutations=;InterPro=;UniProtKB/TrEMBL=;SWISS-MODEL=Q79FZ9",mce1A,Rv0169,Mce-family protein Mce1A,"virulence, detoxification, adaptation",197660,198529,199895,200935,FALSE,TRUE,AATCTCACGGTGTAG,GGGATAACACGATCA,ATG,-1.469835,9,FALSE,FALSE,-2.78552,16,,4,,ATGA,15,1
CDS,199895,200935,+,"Locus=Rv0170;Name=mce1B;Function=Unknown, but thought to be involved in host cell invasion.;Product=Mce-family protein Mce1B;Comments=Rv0170, (MTCI28.10), len: 346 aa. Mce1B (alternate gene name: mceD); belongs to 24-membered Mycobacterium tuberculosis Mce protein family (see citations below), highly similar to Mycobacterium tuberculosis proteins O07788|Rv0590|MTCY19H5.32c|mce2B (275 aa); O53968|Rv1967|MTV051.05|mce3B (342 aa); etc. Also highly similar to others e.g. NP_302657.1|NC_002677 putative secreted protein from Mycobacterium leprae (346 aa); CAC12797.1|AL445327 putative secreted protein from Streptomyces coelicolor (354 aa); etc. Contains hydrophobic region in N-terminal 30 residues. In Escherichia coli, N-terminal part is functional and directs export of a leaderless beta-lactamase into the periplasm (see Chubb et al., 1998). Predicted to be an outer membrane protein (See Song et al., 2008).;UniProt_AC=O07414;Is_Pseudogene=No;Functional_Category=virulence, detoxification, adaptation;Protein Data Bank=;PFAM=O07414;UniProt=O07414;Gene Ontology=;Enzyme Classification=;Drug Resistance Mutations=;InterPro=;UniProtKB/TrEMBL=;SWISS-MODEL=O07414",mce1B,Rv0170,Mce-family protein Mce1B,"virulence, detoxification, adaptation",198534,199898,200932,202479,TRUE,TRUE,GGGATAACACGATCA,CGGGTAGGTGCACGC,ATG,-2.78552,16,FALSE,TRUE,-6.790705,11,4,4,ATGA,ATGA,15,1
CDS,200932,202479,+,"Locus=Rv0171;Name=mce1C;Function=Unknown, but thought to be involved in host cell invasion.;Product=Mce-family protein Mce1C;Comments=Rv0171, (MTCI28.11), len: 515 aa. Mce1C; belongs to 24-membered Mycobacterium tuberculosis Mce protein family (see citations below), highly similar to Mycobacterium tuberculosis proteins O07787|Rv0591|MTCY19H5.31|mce2C (481 aa); O53969|Rv1968|MTV051.06|mce3C (410 aa); etc. Also highly similar to others e.g. NP_302658.1|NC_002677 putative secreted protein from Mycobacterium leprae (519 aa); CAC12796.1|AL445327 putative secreted protein from Streptomyces coelicolor (351 aa); etc. Weakly similar to downstream ORF Rv0172|MTCI28.12|mce1D (530 aa), FASTA score: (24.6% identity in 552 aa overlap). Contains possible signal sequence and highly proline-rich C-terminus. Predicted to be an outer membrane protein (See Song et al., 2008).;UniProt_AC=O07415;Is_Pseudogene=No;Functional_Category=virulence, detoxification, adaptation;Protein Data Bank=;PFAM=O07415;UniProt=O07415;Gene Ontology=;Enzyme Classification=;Drug Resistance Mutations=;InterPro=;UniProtKB/TrEMBL=;SWISS-MODEL=O07415",mce1C,Rv0171,Mce-family protein Mce1C,"virulence, detoxification, adaptation",199895,200935,202476,204068,TRUE,TRUE,CGGGTAGGTGCACGC,TGACGGGAGGTAGCG,ATG,-6.790705,11,TRUE,TRUE,-10.790705,9,4,4,ATGA,TTGA,15,1
CDS,202476,204068,+,"Locus=Rv0172;Name=mce1D;Function=Unknown, but thought to be involved in host cell invasion.;Product=Mce-family protein Mce1D;Comments=Rv0172, (MTCI28.12), len: 530 aa. Mce1D; belongs to 24-membered Mycobacterium tuberculosis Mce protein family (see citations below), highly similar to Mycobacterium tuberculosis proteins O07786|Rv0592|MTCY19H5.30c|mce2D (508 aa); O53970|Rv1969|MTV051.07|mce3D (423 aa); etc. Also highly similar to others e.g. NP_302659.1|NC_002677 putative secreted protein from Mycobacterium leprae (531 aa); CAC12795.1|AL445327 putative secreted protein from Streptomyces coelicolor (337 aa); etc. Hydrophobic region at N-terminus. Predicted to be an outer membrane protein (See Song et al., 2008).;UniProt_AC=O07416;Is_Pseudogene=No;Functional_Category=virulence, detoxification, adaptation;Protein Data Bank=;PFAM=O07416;UniProt=O07416;Gene Ontology=;Enzyme Classification=;Drug Resistance Mutations=;InterPro=;UniProtKB/TrEMBL=;SWISS-MODEL=O07416",mce1D,Rv0172,Mce-family protein Mce1D,"virulence, detoxification, adaptation",200932,202479,204065,205237,TRUE,TRUE,TGACGGGAGGTAGCG,CTGAGGCAGGAGGGG,TTG,-10.790705,9,TRUE,TRUE,-9.71615,8,4,4,TTGA,ATGA,15,1
CDS,206814,207455,+,"Locus=Rv0175;Name=Rv0175;Function=Unknown;Product=Probable conserved Mce associated membrane protein;Comments=Rv0175, (MTCI28.15), len: 213 aa. Probable conserved Mce-associated membrane protein, equivalent, but longer in N-terminus, to CAC32127.1|AL583926 possible membrane protein from Mycobacterium leprae (182 aa). Also similar to mce-associated proteins from Mycobacterium tuberculosis e.g. Rv1363c, Rv0177, Rv1973, etc. Contains two 12 residue direct repeats at N-terminus. A core mycobacterial gene; conserved in mycobacterial strains (See Marmiesse et al., 2004).;UniProt_AC=O07419;Is_Pseudogene=No;Functional_Category=cell wall and cell processes;Protein Data Bank=;PFAM=;UniProt=O07419;Gene Ontology=;Enzyme Classification=;Drug Resistance Mutations=;InterPro=;UniProtKB/TrEMBL=;SWISS-MODEL=O07419",Rv0175,Rv0175,Probable conserved Mce associated membrane protein,cell wall and cell processes,205231,206778,207452,208420,FALSE,TRUE,TAAGTCGTCGTCTAC,AACTCGACCAGGTGA,GTG,0.9151,17,FALSE,TRUE,-3.82996,7,,4,,GTGA,16,1
CDS,207452,208420,+,"Locus=Rv0176;Name=Rv0176;Function=Unknown;Product=Probable conserved Mce associated transmembrane protein;Comments=Rv0176, (MTCI28.16), len: 322 aa. Probable conserved Mce-associated transmembrane protein. Contains short region of similarity to PRA_MYCLE|P41484 proline-rich antigen (36 kDa antigen) from Mycobacterium leprae (249 aa) (outside the proline-rich region), FASTA scores: opt: 165, E(): 2.9e-05, (40.0% identity in 65 aa overlap). Also similar to mce-associated proteins from Mycobacterium tuberculosis e.g. Rv1363c, Rv0177, Rv3493c, etc. A core mycobacterial gene; conserved in mycobacterial strains (See Marmiesse et al., 2004).;UniProt_AC=O07420;Is_Pseudogene=No;Functional_Category=cell wall and cell processes;Protein Data Bank=;PFAM=O07420;UniProt=O07420;Gene Ontology=GO:0016021;Enzyme Classification=;Drug Resistance Mutations=;InterPro=;UniProtKB/TrEMBL=;SWISS-MODEL=",Rv0176,Rv0176,Probable conserved Mce associated transmembrane protein,cell wall and cell processes,206814,207455,208417,208971,TRUE,TRUE,AACTCGACCAGGTGA,GACAACCCACCGGCG,GTG,-3.82996,7,TRUE,FALSE,0.827129999999999,7,4,4,GTGA,ATGA,16,1
CDS,214969,215718,+,"Locus=Rv0184;Name=Rv0184;Function=Function unknown;Product=Conserved hypothetical protein;Comments=Rv0184, (MTCI28.24), len: 249 aa. Conserved hypothetical protein, equivalent to CAC32136.1|AL583926 conserved hypothetical protein from Mycobacterium leprae (249 aa); and C-terminus highly similar to CAB08793.1|Z95398 conserved hypothetical protein from Mycobacterium leprae (145 aa), FASTA scores: E(): 0, (75.2 identity in 145 aa overlap). Also similar to 049841|SCE9_39|T36358 hypothetical protein from Streptomyces coelicolor (418 aa), FASTA scores: opt: 231, E(): 8.1e-08, (30.4% identity in 270 aa overlap). A core mycobacterial gene; conserved in mycobacterial strains (See Marmiesse et al., 2004).;UniProt_AC=O07428;Is_Pseudogene=No;Functional_Category=conserved hypotheticals;Protein Data Bank=;PFAM=;UniProt=O07428;Gene Ontology=;Enzyme Classification=;Drug Resistance Mutations=;InterPro=;UniProtKB/TrEMBL=;SWISS-MODEL=",Rv0184,Rv0184,Conserved hypothetical protein,conserved hypotheticals,214088,214927,215715,216224,FALSE,TRUE,CTCCACTAGTTTTGG,CACGGGCCGCGCTGG,ATG,-0.872870000000002,5,FALSE,FALSE,-2.58185,5,,4,,GTGA,17,1
CDS,236550,237209,+,"Locus=Rv0199;Name=Rv0199;Function=Unknown;Product=Probable conserved membrane protein;Comments=Rv0199, (MTV033.07), len: 219 aa. Probable conserved membrane protein, equivalent to Z95398|MLCL622.13 from Mycobacterium leprae (224 aa), FASTA scores: opt: 920, E(): 0, (67.7% identity in 220 aa overlap). Also some similarity to Mce-associated membrane proteins from Mycobacterium tuberculosis e.g. Rv0178, Rv0175, etc. A core mycobacterial gene; conserved in mycobacterial strains (See Marmiesse et al., 2004).;UniProt_AC=O53650;Is_Pseudogene=No;Functional_Category=cell wall and cell processes;Protein Data Bank=;PFAM=;UniProt=O53650;Gene Ontology=;Enzyme Classification=;Drug Resistance Mutations=;InterPro=;UniProtKB/TrEMBL=;SWISS-MODEL=O53650",Rv0199,Rv0199,Probable conserved membrane protein,cell wall and cell processes,232231,234519,237206,237895,FALSE,TRUE,CGGGTGCAACGATCG,CCCGGTTGGAGTCGA,ATG,-3.00755,15,FALSE,TRUE,-3.756025,6,,4,,ATGA,19,1
CDS,249038,250123,+,"Locus=Rv0209;Name=Rv0209;Function=Unknown;Product=Hypothetical protein;Comments=Rv0209, (MTCY08D5.04), len: 361 aa. Hypothetical unknown protein.;UniProt_AC=P96391;Is_Pseudogene=No;Functional_Category=conserved hypotheticals;Protein Data Bank=;PFAM=;UniProt=P96391;Gene Ontology=;Enzyme Classification=;Drug Resistance Mutations=;InterPro=;UniProtKB/TrEMBL=;SWISS-MODEL=P96391",Rv0209,Rv0209,Hypothetical protein,conserved hypotheticals,243384,244487,250120,251598,FALSE,TRUE,CGAACCGATCGGGTG,ACCGATACCGGAAGT,ATG,-3.00755,6,FALSE,FALSE,-1.247805,8,,4,,GTGA,20,1
CDS,277899,278588,+,"Locus=Rv0232;Name=Rv0232;Function=Involved in transcriptional mechanism.;Product=Probable transcriptional regulatory protein (probably TetR/AcrR-family);Comments=Rv0232, (MTCY08D5.28), len: 229 aa. Probable transcriptional regulatory protein, TetR/AcrR family, similar to others e.g. YIXD_BACSU|P32398 hypothetical transcriptional regulator (191 aa), FASTA scores: opt: 149, E(): 0.0014, (21.5% identity in 158 aa overlap). Also similar to MTV030_11 from Mycobacterium tuberculosis. Contains PS01081 Bacterial regulatory proteins, TetR family signature, and probable helix-turn helix motif from aa 33-54 (Score 1142, +3.08 SD). Belongs to the TetR/AcrR family of transcriptional regulators.;UniProt_AC=P96415;Is_Pseudogene=No;Functional_Category=regulatory proteins;Protein Data Bank=;PFAM=P96415;UniProt=P96415;Gene Ontology=GO:0006350,GO:0003700,GO:0006355;Enzyme Classification=;Drug Resistance Mutations=;InterPro=;UniProtKB/TrEMBL=;SWISS-MODEL=P96415",Rv0232,Rv0232,Probable transcriptional regulatory protein (probably TetR/AcrR-family),regulatory proteins,276058,277764,278585,279529,FALSE,TRUE,ACCAACGCAAGGAGG,CCCGATCGGAGGAGA,ATG,-11.71615,6,TRUE,TRUE,-6.856025,8,,4,,ATGA,21,1
CDS,342130,344025,+,"Locus=Rv0282;Name=eccA3;Function=Function unknown;Product=ESX conserved component EccA3. ESX-3 type VII secretion system protein.;Comments=Rv0282, (MTV035.10), len: 631 aa. eccA3, esx conserved component, ESX-3 type VII secretion system protein, similar to Y14967|MLCB628.18c hypothetical protein from Mycobacterium leprae (573 aa), FASTA scores: opt: 916, E(): 0, (38.7% identity in 568 aa overlap). Also similar to Mycobacterium tuberculosis proteins e.g. Z94121|MTY15F10.26 (619 aa), FASTA scores: opt: 743, E(): 0, (29.9% identity in 612 aa overlap). Member of CFXQ, CBXP family - 9 members in Mycobacterium tuberculosis. Contains PS00017 ATP/GTP-binding site motif A (P-loop).;UniProt_AC=P9WPI3;Is_Pseudogene=No;Functional_Category=cell wall and cell processes;Protein Data Bank=;PFAM=O53687;UniProt=P9WPI3;Gene Ontology=GO:0005737,GO:0017111,GO:0005524;Enzyme Classification=;Drug Resistance Mutations=;InterPro=;UniProtKB/TrEMBL=;SWISS-MODEL=P9WPI3",eccA3,Rv0282,ESX conserved component EccA3. ESX-3 type VII secretion system protein.,cell wall and cell processes,340998,341906,344022,345638,FALSE,TRUE,AGTTCAGGCGGATCG,TCGGGCTCTCGGTGC,ATG,-3.241975,6,FALSE,TRUE,-3.578815,7,,4,,ATGA,23,1
